Drept Procesual Civil,"21.  A - în calitate de vânzător, a încheiat cu B - în calitate de cumpărător, la data de 02.2014, un contract de vânzare cu privire la un bun mobil, preţul acceptat de părţi fiind de 120.000 de lei. Acest preţ urma să fie achitat de către cumpărător în 60 de zile de la data perfectării vânzării. De asemenea, la data încheierii contractului de vânzare, bunul mobil a fost predat cumpărătorului. La data scadenţei, cumpărătorul B nu şi-a executat obligaţia de plată. În acest context, vânzătorul A vă solicită ajutorul, în calitate de avocat, pentru formularea şi depunerea unei cereri de rezoluţiune a acestei vânzări. Cu privire la această cerere de chemare în judecată:","A. aceasta este de competenţa materială a tribunalului, dacă nu se solicită, pe lângă rezoluţiune, şi repunerea părţilor în situaţia anterioară, în acest caz fiind o cerere neevaluabilă în bani
B. aceasta nu este evaluabilă în bani dacă, pe lângă rezoluţiune, nu se formulează şi o cerere privind repunerea părţilor în situaţia anterioară
C. aceasta este evaluabilă în bani, indiferent dacă se solicită sau nu, pe lângă rezoluţiune, şi repunerea părţilor în situaţia anterioară, competenţa materială aparţinând judecătoriei",C
Drept Procesual Civil,41.  Reprezintă o excepţie de la aplicarea principiului nemijlocirii:,"A. cazul administrării probei cu expertiza judiciară atunci când aceasta presupune o lucrare la faţa locului
B. cazul administrării probelor prin comisie rogatorie
C. cazul administrării probelor direct în instanţa de apel",B
Drept Procesual Civil,"60.  AA, în calitate de reclamant, introduce prin mandatar neavocat MM, în contradictoriu cu pârâtul BB, o cerere de chemare în judecată prin care solicită lăsarea în deplină proprietate și pașnică folosință imobilul situat la adresa Y. La cerere nu se anexează și înscrisul doveditor al calității de mandatar neavocat a lui MM. După comunicarea cererii de chemare în judecată, pârâtul BB:","A. este obligatoriu să invoce prin întâmpinare excepția lipsei dovezii calității de reprezentant pentru a evita sancțiunea decăderii, excepția fiind de ordine privată
B. este în drept să invoce excepția lipsei dovezii calității de reprezentant în tot cursul judecății în primă instanță, cât și direct în calea de atac
C. este în drept să invoce excepția lipsei dovezii calității de reprezentant în tot cursul judecății în primă instanță",C
Drept Procesual Civil,49.  Nu este adevărat că:,"A. prin cererea reconvenţională, pârâtul poate chema în judecată şi alte persoane pe lângă reclamantul din cererea principală
B. în cazul modificării cererii de chemare în judecată, legea prevede expres că întâmpinarea trebuie formulată în termen de 10 zile de la comunicarea cererii modificate
C. întâmpinarea față de cererea de chemare în judecată modificată va fi cercetată de reclamant la dosarul cauzei",B
Drept Procesual Civil,46.  În cazul în care fostul soț al judecătorului este afin de gradul II cu una dintre părți:,"A. partea interesată poate cere recuzarea judecătorului înainte de începerea oricărei dezbateri, dacă motivul i- a fost cunoscut anterior acestui moment
B. judecătorul nu poate participa la judecată, chiar dacă nu s-a abținut ori nu a fost recuzat
C. judecătorul este incompatibil, fiind incident un caz de incompatibilitate absolută",A
Drept Procesual Civil,"52.  AA formulează o cerere de chemare în judecată împotriva pârâtului BB solicitând obligarea acestuia la plata unei sume de bani. Prin întâmpinare, pârâtul BB solicită respingerea cererii de chemare în judecată, solicitând și judecarea cauzei în lipsă. Prin sentința pronunțată de instanţa de fond, cererea de chemare în judecată este respinsă ca neîntemeiată. Reclamantul AA formulează apel iar intimatul-pârât BB nu formulează întâmpinare la apel. La primul termen în apel, instanța constatând lipsa nejustificată a ambelor părți, legal citate şi că niciuna dintre părţi nu a cerut judecarea în lipsă, pentru faza apelului, dispune suspendarea judecării apelului. Intimatul-pârât BB formulează recurs după 35 de zile de la comunicare încheierii de suspendare, motivat de faptul că a solicitat judecarea în lipsă la prima instanţă, iar apelantul-reclamant AA, prin întâmpinare la recurs, invocă tardivitatea recursului. În acest caz instanţa de recurs:","A. va respinge excepția tardivității recursului;
B. va respinge recursul ca nefondat;
C. va admite recursul, va casa încheierea de suspendare și va trimite cauza pentru continuarea soluționării",AB
Drept Procesual Civil,"43.  Prin cererea de chemare în judecată formulată de către AA și depusă la Judecătoria C., reclamantul AA, în contradictoriu cu pârâtul BB solicită constatarea nulității absolute a contractului de vânzare a imobilului situat în București, în valoare de 250.000 lei, încheiat între AA și BB și repunerea părților în situația anterioară. În acest caz:","A. acțiunea formulată este personală imobiliară;
B. competența de soluționare aparține tribunalului, acțiunea fiind evaluabilă în bani;
C. competența teritorială aparține exclusiv instanței de la locul situării imobilului.",AB
Drept Procesual Civil,51.  Termenul procedural:,"A. indiferent de unitatea de timp în care este stabilit, se prelungește până în prima zi lucrătoare care urmează, dacă ultima zi a termenului cade într-o zi nelucrătoare
B. nu se întrerupe atunci când, după ce termenul a început să curgă, a intervenit moartea părții, deoarece în acest caz se va face o nouă comunicare la ultimul domiciliu al părții decedate, pe numele moștenirii, fără
C. începe să curgă, dacă legea nu dispune altfel, de la data comunicării actului de procedură, considerânduse că actul a fost comunicat părții și în cazul în care aceasta a primit sub semnătură o copie de pe act ori",AC
Drept Procesual Civil,"51.  Judecătoria Sfântu Gheorghe a soluționat în primă instanță o cerere de partaj succesoral. Tribunalul Covasna, învestit cu judecarea căii de atac, a dispus prin încheiere suspendarea judecății, apreciind că dezlegarea cauzei depinde de existenţa ori inexistenţa unui drept care face obiectul unei alte judecăţi. Împotriva acestei încheieri:","A. partea interesată va putea formula recurs, care este admisibil şi în cazul în care este exercitat împotriva încheierii de suspendare a judecății pronunţate de instanţa de apel, chiar dacă în prezentul litigiu apelul este ultima cale de atac de reformare
B. se poate formula recurs în termen de 5 zile de la comunicarea încheierii de suspendare a judecății
C. recursul este inadmisibil deoarece hotărârea Tribunalului Covasna este, potrivit legii, definitivă",A
Drept Procesual Civil,"26.  În cursul judecății apelului declarat împotriva hotărârii primei instanțe, de către apelantul- reclamant AA, în contradictoriu cu intimatul-pârât BB, terțul intervenient CC, formulează o cerere de intervenție accesorie în favoarea intimatului-pârât BB. După admiterea în principiu a cererii de intervenție, intervenientul CC formulează o cerere de chemare în garanție a terțului DD pentru ca acesta să suporte despăgubirile la care ar urma să fie obligat intimatul-pârât BB în eventualitatea în care ar cădea în pretenții față de apelantul-reclamant AA. În acest context:","A. cererea de chemare în garanție este admisibilă în principiu, întrucât este promovată de intervenientul care poate formula cerere de intervenție accesorie în apel
B. cererea de chemare în garanție formulată de intervenientul accesoriu CC este inadmisibilă
C. cu privire la cererea de chemare în garanție formulată de intervenientul accesoriu CC, instanţa o va respinge ca lipsită de interes, după admiterea în principiu a acesteia",B
Drept Procesual Civil,"59.  În cazul suspendării judecății dispusă de instanţa judecătorească până la pronunţarea de către Curtea de Justiţie a Uniunii Europene a unei hotărâri preliminare, ca urmare a solicitării unei alte instanţe naționale sau a unei instanţe dintr-un alt stat membru al Uniunii Europene (caz de suspendare facultativă a judecății):","A. poate interveni perimarea cererii de chemare în judecată, în ipoteza în care partea interesată nu solicită
B. nu va interveni perimarea cererii de chemare în judecată
C. instanța de judecată este obligată să dispună din oficiu reluarea judecării procesului după pronunţarea",BC
Drept Procesual Civil,28.  În ceea ce priveşte cererea de chemare în garanţie:,"A. dacă pârâtul a introdus cererea de chemare în garanţie, iar prima instanţă a admis atât cererea de chemare în judecată, cât şi cererea de chemare în garanție, chematul în garanţie poate formula apel şi contra reclamantului, invocând netemeinicia cererii de chemare în judecată
B. dacă pârâtul a formulat cererea de chemare în garanţie, iar prima instanţă a respins atât cererea de chemare în judecată neîntemeiată, cât şi cererea de chemare în garanţie ca lipsită de obiect, dacă reclamantul face apel, pârâtul-intimat dobândeşte interesul de a introduce un apel provocat pentru a repune în discuţie şi cererea de chemare în garanţie
C. dacă reclamantul a formulat o cerere de chemare în garanţie, iar prima instanţă a respins cererea de chemare în judecată şi a admis cererea de chemare în garanţie, chematul în garanţie nu este în drept să formuleze apel împotriva pârâtului",AB
Drept Procesual Civil,"27.  La ultimul termen de judecată în fața primei instanțe, după administrarea probelor încuviințate și înainte de a acorda cuvântul părţilor pentru a-și susține concluziile asupra fondului cauzei, instanța invocă din oficiu şi pune în discuția părților excepția lipsei capacității procesuale de folosință a pârâtului. În acest caz:","A. instanța nu putea invoca din oficiu şi pune în discuția părților excepția lipsei capacității procesuale de folosință a pârâtului, această excepție putând fi invocată numai de către reclamant
B. instanța era îndrituită să invoce din oficiu excepția lipsei capacității procesuale de folosință a pârâtului şi să o pună în discuția părţilor, chiar și în această etapă a procesului
C. excepția lipsei capacității procesuale de folosință a pârâtului este o excepție relativă și peremptorie",B
Drept Procesual Civil,59.  Hotărârea care consfințește tranzacţia intervenită între părţi:,"A. nu este supusă nici unei căi de atac
B. ca regulă, poate fi atacată, pentru motive procedurale, numai la instanţa ierarhic superioară
C. are autoritate de lucru judecat cu privire la fondul pretenţiei dedus judecăţii",B
Drept Procesual Civil,52.  În cazul în care se dispune disjungerea de cererea de chemare în judecată:,"A. cererea de chemare în garanţie va fi soluţionată de instanţa competentă din punct de vedere material şi teritorial potrivit regulilor de drept comun
B. cererea de chemare în garanţie va fi judecată de instanţa care judecă cererea principală, operând o prorogare legală de competenţă
C. cererea de chemare în judecată va fi soluţionată de instanţa competentă din punct de vedere material şi teritorial potrivit regulilor de drept comun, dacă reclamantul renunță la judecarea cererii principale",B
Drept Procesual Civil,42.  Sunt de competenţa exclusivă a instanţei de la ultimul domiciliu al defunctului:,"A. cereri prin care moştenitorii valorifică drepturi culese din succesiune împotriva terţilor
B. orice cereri mobiliare sau imobiliare formulate de terţi împotriva moştenitorilor
C. cereri prin care creditorii personali ai defunctului, în contradictoriu cu moştenitorii, valorifică drepturi din contractele încheiate cu defunctul",C
Drept Procesual Civil,"60.  Creditorul A s-a adresat Biroului executorului judecătoresc ”BB” pentru executarea unei hotărâri judecătorești definitive pronunţată în contradictoriu cu debitoarea Agenţia Naţionale de Administrare Fiscală. În cadrul executării silite, creditorul a solicitat și actualizarea cu rata inflației a cheltuielilor de judecată acordate de instanţă prin hotărârea pronunțată, însă executorul a refuzat cererea, prin încheiere motivată. În aceste condiții:","A. cheltuielile de judecată nu pot fi actualizate deoarece au caracter accesoriu şi executorul poate actualiza doar valoarea unei obligaţii principale stabilite în bani
B. chiar dacă acordarea a cheltuielilor de judecată a reprezentat o cerere accesorie în cadrul procesului principal, atunci când hotărârea judecătorească este definitivă, va conţine o creanţă de sine-stătătoare împotriva părții care a pierdut procesul și care poate fi supusă actualizării în faza executării silite
C. creditorul este îndreptăţit să formuleze contestație la executare împotriva încheierii executorului judecătoresc, care se poate face oricând înăuntrul termenului de prescripţie a dreptului de a obţine executarea silită",B
Drept Procesual Civil,60.  Sesizarea Înaltei Curți de Casație și Justiție în vederea pronunţării unei hotărâri prealabile pentru dezlegarea unor chestiuni de drept:,"A. poate fi formulată de către un complet al judecătoriei învestit cu soluționarea cauzei, după dezbateri
B. va fi soluționată prin decizie care se motivează în termen de cel mult 30 de zile de la pronunţare şi se
C. va fi soluționată fără citarea părților, în cel mult 3 luni de la data învestirii",BC
Drept Procesual Civil,45.  ,"A. care nu are calitatea de avocat, se dovedeşte prin înscris sub semnătură legalizată
B. care nu are calitatea de avocat, poate fi dată şi prin declarație verbală, făcută în instanţă şi consemnată în
C. care nu are calitatea de avocat, dă dreptul acestuia de a pune concluzii asupra excepţiilor procesuale,",B
Drept Procesual Civil,53.  Suspendarea executării silite până la soluţionarea contestaţiei la executare:,"A. se dispune prin încheiere care poate fi atacată numai cu apel, în mod separat, în termen de 5 zile, termen care curge de la comunicarea încheierii, pentru partea prezentă
B. este obligatorie, cauţiunea nefiind necesară, dacă înscrisul care se execută a fost declarat fals printr-o hotărâre judecătorească dată în primă instanţă
C. se dispune, în caz de admitere, prin încheiere care se comunică executorului judecătoresc, la cererea debitorului",B
Drept Procesual Civil,"52.  La data de 12 mai 2021 s-a dispus suspendarea unei cauze aflate pe rolul Judecătoriei P., pentru lipsa părților legal citate. În data de 22 decembrie 2021 a fost fixat termen pentru discutarea perimării acestei cauze. La dosarul cauzei se constată depusă, de către reclamant, o cerere de repunere pe rol a cauzei (înregistrată la data de 8 noiembrie 2021), care a fost anulată ca netimbrată. În acest caz, instanța:","A. va constata perimarea cererii de chemare în judecată
B. va reține că nu a intervenit întreruperea termenului de perimare
C. va constata că cererea nu este perimată pe considerentul că a operat o suspendare a termenului de",AB
Drept Procesual Civil,42.  ,"A. nu parcurge etapa admisibilității în principiu
B. nu trebuie făcută în forma unei cereri de chemare în judecată
C. poate fi făcută doar de către pârât",BC
Drept Procesual Civil,46.  Cererea de recuzare a unui judecător din completul de judecată învestit cu soluţionarea cererii:,"A. determină suspendarea judecăţii dacă se invocă un motiv de incompatibilitate absolută
B. se depune într-un singur exemplar
C. pentru motive de incompatibilitate cunoscute de parte de la începutul procesului nu poate fi formulată după discutarea mijloacelor de probă, tardivitatea putând fi însă constatată numai de către un complet din care nu face parte judecătorul recuzat",BC
Drept Procesual Civil,58.  Hotărârea judecătorească de primă instanţă în procedura ordonanţei de plată:,"A. devine definitivă ca urmare a neintroducerii sau respingerii cererii în anulare
B. poate fi pusă în executare silită, iar împotriva executării nu se poate face contestaţie la executare
C. nu este executorie, dacă este atacată cu cerere în anulare",A
Drept Procesual Civil,"60.  Reclamantul AA introduce o cerere de chemare în judecată în contradictoriu cu pârâtul BB. La primul termen de judecată se prezintă personal atât reclamantul AA care a fost legal citat, cât şi pârâtul BB, deşi acesta nu primise citaţia pentru acest termen. În acest caz:","A. având în vedere că procedura de citare cu pârâtul BB nu s-a realizat, instanţa va amâna judecata şi va
B. procesul se va amâna la cererea pârâtului BB
C. procesul nu se va amâna dacă nu există o cerere de amânare din partea părţii interesate",BC
Drept Procesual Civil,43.  Acțiunea civilă:,"A. având ca obiect plata chiriei pentru un imobil închiriat nu este o acțiune reală
B. va fi respinsă fără a se analiza fondul litigiului, dacă instanța constată că dreptul subiectiv pretins de reclamant nu există
C. va fi respinsă fără a se analiza fondul dreptului, dacă se admite excepția lipsei calității procesuale active",AC
Drept Procesual Civil,43.  Declarația de abținere sau cererea de recuzare:,"A. se judecă de instanţa ierarhic superioară, când, din pricina abținerii sau recuzării, nu se poate alcătui
B. se judecă, în toate cazurile, de instanța ierarhic superioară
C. se soluționează, de îndată, în camera de consiliu, fără prezența părților, ascultând judecătorul recuzat",AC
Drept Procesual Civil,"23.  Reclamantul AA depune la data de 1 septembrie 2021, la Judecătoria X, o cerere de chemare în judecată, formulată în contradictoriu cu pârâtul BB. În procedura de verificare şi regularizare a cererii, completul căruia i s-a repartizat cauza îi comunică reclamantului AA o adresă de regularizare prin care i se pune în vedere ca, în termen de 10 zile de la primirea adresei, să completeze cererea de chemare în judecată, sub aspectul indicării motivării în fapt a acesteia şi să indice numele şi prenumele celor doi martori propuşi şi domiciliul acestora. În termenul de 10 zile indicat prin adresa de regularizare, reclamantul AA nu se conformează solicitărilor instanţei, iar aceasta, prin încheiere, dispune anularea cererii de chemare în judecată. În termen legal, reclamantul AA formulează cerere de reexaminare împotriva încheierii de anulare şi solicită revenirea asupra măsurii anulării, indicând în cererea de reexaminare atât motivarea în fapt a cererii de chemare în judecată, cât şi numele şi adresa celor doi martori. În acest caz, instanţa învestită cu cererea de reexaminare:","A. va admite cererea de reexaminare şi va reveni asupra măsurii anulării cererii de chemare în judecată, motivat de faptul că ori de câte ori este posibilă înlăturarea vătămării fără anularea actului, judecătorul va dispune îndreptarea neregularităților actului de procedură
B. va respinge cererea de reexaminare ca neîntemeiată
C. va admite cererea de reexaminare şi va reveni asupra măsurii anulării cererii de chemare în judecată cu motivarea că actul de procedură nu va fi anulat dacă până la momentul pronunţării asupra excepției de nulitate a dispărut cauza acesteia",B
Drept Procesual Civil,45.  Sunt executorii:,"A. de drept, hotărârile pronunţate în primă instanţă având ca obiect plata salariilor
B. hotărârile având ca obiect revendicare imobiliară, pronunţate în primă instanţă şi atacate cu apel
C. hotărârile pronunţate în ordonanţa de plată, chiar dacă sunt atacate cu cerere în anulare",AC
Drept Procesual Civil,47.  Modificarea cererii de chemare în judecată:,"A. poate fi făcută, sub sancţiunea decăderii, numai până la primul termen la care reclamantul şi pârâtul sunt legal citaţi
B. în primă instanţă, nu poate fi făcută peste termenul prevăzut de lege, chiar dacă părţile îşi dau acordul expres cu privire la depăşirea acestui termen
C. nu se poate face direct în instanţa de apel, chiar dacă există acordul expres al părţilor",C
Drept Procesual Civil,"54.  Spre deosebire de îndreptarea hotărârii judecătoreşti, lămurirea hotărârii judecătoreşti cu privire la înţelesul, întinderea sau aplicarea dispozitivului:","A. nu poate fi dispusă din oficiu de instanţa judecătorească
B. se dispune prin încheiere, dată în camera de consiliu
C. nu poate fi cerută pe calea apelului sau recursului",A
Drept Procesual Civil,43.  În privinţa stabilirii competenţei materiale:,"A. în cazul în care s-ar solicita desfiinţarea contractului şi restituirea bunului, pentru stabilirea competenţei instanţei se va ţine seama de valoarea obiectului contractului
B. în cazul cererilor având ca obiect renta viageră, pentru stabilirea competenţei instanţei se va ţine seama de valoarea prestaţiei anuale datorate
C. în cazul cererilor având ca obiect plata chiriei, atunci când durata locaţiunii este de 5 ani, pentru stabilirea competenţei instanţei se va ţine seama de valoarea prestaţiei anuale datorate",AB
Drept Procesual Civil,41.  Dreptul la apărare nu este încălcat:,"A. dacă partea chemată la interogatoriu refuză să răspundă, fără motive temeinice, iar instanţa socoteşte această împrejurare ca o mărturisire în favoarea celui care a propus interogatoriul
B. dacă partea, nelegal citată, se prezintă la termenul de judecată şi solicită amânarea cauzei, iar instanţa refuză acordarea unui termen în acest scop
C. dacă judecătorul dispune înfăţişarea în persoană a părţilor, chiar dacă acestea sunt reprezentate",AC
Drept Procesual Civil,"50.  Reclamantului AA i se comunică într-o zi de vineri, în data de 17 martie 2023, hotărârea pronunțată de Judecătoria X prin care instanța de judecată i-a respins acestuia cererea de ordonanță președințială pe motiv că nu a dovedit urgența. Ordonanța președințială a fost dată fără citarea părților. Reclamantul AA, nemulțumit de hotărârea comunicată, intenţionează să formuleze apel. În acest caz:","A. ultima zi a termenului pentru introducerea apelului este marți, 21 martie 2023
B. ultima zi a termenului pentru introducerea apelului este joi, 23 martie 2023
C. pentru calcularea termenului pentru formularea apelului se iau în calcul şi zilele de sâmbătă, 18 martie",BC
Drept Procesual Civil,53.  Poate constitui un început de dovadă scrisă:,"A. un înscris care nu este semnat de către parte, dar care provine de la aceasta
B. un înscris sub semnatură privată, semnat de părți
C. un înscris sub semnatură privată, care nu îndeplinește cerința multiplului exemplar",AC
Drept Procesual Civil,"48.  Prin cererea de chemare în judecată, reclamantul AA a solicitat evacuarea pârâtului BB, pentru neplata chiriei şi stricăciuni aduse locuinţei, proprietatea reclamantului. La al doilea termen de judecată, pârâtul BB a achitat chiria restantă şi cheltuielile de întreținere. La acelaşi termen, reclamantul, observând că din probele administrate în cauză rezultă că pârâtul a întreţinut locuinţa în mod corespunzător, a depus o precizare de acţiune prin care a solicitat evacuarea lui BB pentru lipsa titlului locativ, invocând faptul că, în realitate, acesta nu avea contract de închiriere cu proprietarul apartamentului. În acest caz:","A. pârâtul se poate opune la primirea acestei ”precizări”, motivând că este o modificare a cererii de chemare în judecată, făcută peste termenul prevăzut de lege
B. „precizarea” de acţiune a reclamantului va fi primită de instanță și analizată,   pentru că nu reprezintă o modificare a acțiunii ale cărei elemente esențiale rămân neschimbate (părți, obiect, cauză)
C. instanța va primi modificarea cererii de chemare în judecată peste termenul prevăzut de lege, dacă pârâtul își exprimă acordul expres în acest sens",AC
Drept Procesual Civil,52.  Hotărârea judecătorească:,"A. poate fi lămurită cu privire la înţelesul, întinderea sau aplicarea considerentelor hotărârii ori dacă acestea sunt contradictorii, la cererea părților, prin încheiere dată în camera de consiliu, cu citarea părţilor
B. se va întocmi în două exemplare originale
C. se va comunica din oficiu părților, în copie, chiar dacă este definitivă",BC
Drept Procesual Civil,51.  Instanţa de executare:,"A. dacă prin lege nu se prevede altfel, se pronunţă prin încheiere executorie care poate fi atacată numai cu apel în termen de 10 zile de la comunicare
B. este tribunalul în a cărui circumscripție se află, la data sesizării organului de executare, domiciliul sau după caz, sediul debitorului, în afara cazurilor în care legea dispune altfel
C. este, în toate cazurile, judecătoria de la domiciliul sau sediul debitorului",A
Drept Procesual Civil,49.  În cazul intervenţiei voluntare principale:,"A. intervenientul voluntar principal poate să solicite administrarea de probe, prin cererea de intervenție sau cel mai târziu până la primul termen de judecată ulterior admiterii cererii de intervenție
B. se va dispune disjungerea atunci când judecarea cererii de intervenţie voluntare principale ar fi întârziată de cererea principală
C. cererea de intervenţie voluntară principală este inadmisibilă în cazul unui proces de divorţ, cu privire la desfacerea căsătoriei",AC
