Drept Procesual Civil,52.  În ceea ce priveşte perimarea:,"A. dacă instanţa constată că perimarea nu a intervenit, pronunţă o încheiere care este supusă separat recursului, la instanţa ierarhic superioară, în termen de 5 zile de la pronunţare
B. dacă instanţa constată că a intervenit perimarea pronunţă o hotărâre care este supusă recursului, la instanţa ierarhic superioară, în termen de 5 zile de la pronunţare, cu excepţia cazului în care perimarea este constatată de o secţie a Înaltei Curţi de Casaţie şi Justiţie, caz în care hotărârea de perimare este definitivă
C. aceasta operează şi în cazul cererilor de competenţa unor organe de jurisdicţie din afara sistemului instanţelor judecătoreşti, în măsura în care nu există o normă specială care să dispună altfel",C
Drept Procesual Civil,41.  În procedura necontencioasă judiciară de drept comun:,"A. instanța încuviințează cererea prin încheiere executorie împotriva căreia se poate exercita numai apel, cu excepția celei pronunţate de un complet al Înaltei Curți de Casație și Justiție, care este definitivă
B. dacă cererea dedusă judecății, prin însuşi cuprinsul ei ori prin obiecțiile ridicate de persoanele citate sau
C. încheierea prin care instanța soluționează cererea are autoritate de lucru judecat",A
Drept Procesual Civil,59.  În cadrul executării silite:,"A. nu pot fi puse în executare hotărârile arbitrale, dacă au fost atacate cu acțiune în anulare
B. în lipsa originalului unui act autentificat de notarul public, care constată o creanță certă, lichidă și exigibilă, duplicatul nu poate constitui titlu executoriu
C. cambia constituie titlu executoriu, dacă îndeplinește condițiile prevăzute în legea specială",C
Drept Procesual Civil,52.  Nu este necesară plata unei cauțiuni pentru suspendarea executării silite:,"A. în cazul în care executarea silită a fost declanșată în temeiul unei ordonanțe de plată împotriva căreia a fost formulată cerere în anulare
B. în cazul în care executarea silită a fost declanșată în temeiul unui înscris care nu este titlu executoriu,
C. în cazul în care debitorul face dovada, printr-un înscris sub semnătură privată, că a obținut de la creditor o",B
Drept Procesual Civil,"47.  Împuternicirea de a reprezenta o persoană fizică, parte litigantă într-un proces civil, dată mandatarului care nu are calitatea de avocat:","A. se dovedeşte prin înscris autentic
B. se poate da şi prin declaraţie verbală, făcută în instanţă şi consemnată în încheierea de şedinţă cu arătarea limitelor şi a duratei reprezentării
C. se poate proba şi prin înscris sub semnătură privată, atestat de avocat",AB
Drept Procesual Civil,59.  Sunt supuse procedurii regularizării:,"A. cererea confesorie de servitute
B. contestația la executare, atunci când executarea silită priveşte un titlu executoriu altul decât o hotărâre judecătorească
C. cererea de chemare în garanție",A
Drept Procesual Civil,56.  Autoritatea de lucru judecat a unei hotărâri judecătoreşti:,"A. apare numai în cazul unei hotărâri prin care s-a soluţionat, în tot sau în parte, fondul procesului
B. nu poate privi considerentele hotărârii
C. este provizorie în cazul în care hotărârea este supusă apelului sau recursului",C
Drept Procesual Civil,43.  Comunicarea citaţiei:,"A. se va face unei persoane majore din familie sau, în lipsă, oricărei persoane majore care locuieşte cu destinatarul ori care, în mod obişnuit, îi primeşte corespondenţa, dacă destinatarul refuză să primească citaţia
B. se va face prin depunere în cutia poştală, dacă destinatarul refuză să primească citaţia
C. se va face unei persoane majore din familie sau, în lipsă, oricărei persoane majore care locuieşte cu destinatarul ori care, în mod obişnuit, îi primeşte corespondenţa, dacă destinatarul primeşte citaţia, dar refuză să semneze dovada de înmânare",B
Drept Procesual Civil,"45.  Împuternicirea de a reprezenta, într-un proces civil, o persoană fizică, dată mandatarului:","A. care nu are calitatea de avocat, se dovedeşte prin înscris sub semnătură legalizată
B. care nu are calitatea de avocat, poate fi dată şi prin declaraţie verbală, făcută în instanţă şi consemnată în încheierea de şedinţă
C. care nu are calitatea de avocat, dă dreptul acestuia de a pune concluzii asupra excepţiilor procesuale, fără să fie asistat de avocat, în cazul în care mandatarul este rudă până la gradul al treilea inclusiv cu partea pe care o reprezintă, dacă este licenţiat în drept",B
Drept Procesual Civil,"46.  Cererea îndreptată împotriva unei entități, fără personalitate juridică, constituită potrivit legii:","A. se va introduce, în toate cazurile, la instanţa competentă teritorial pentru oricare din membrii entității respective
B. se poate introduce la instanţa competentă teritorial pentru persoana căreia, potrivit înțelegerii dintre membri, i s-a încredinţat conducerea sau administrarea acesteia
C. se va introduce, în toate cazurile, din punct de vedere al competenţei teritoriale, la instanţa de la domiciliul sau sediul reclamantului",B
Drept Procesual Civil,"55.  Partea care a pierdut procesul, în primă instanţă, nu mai are dreptul de a face apel principal, cu privire la întreaga hotărâre, atunci când:","A. a renunţat expres la apel cu privire la hotărârea pronunţată de prima instanţă
B. a pus în executare, în mod voluntar, hotărârea executorie de primă instanţă
C. a pus în executare de bunăvoie integral hotărârea de primă instanţă, deşi aceasta nu era susceptibilă de executare provizorie",AC
Drept Procesual Civil,59.  În cazul procedurii necontencioase judiciare:,"A. dacă cererea necontencioasă, prin însuşi cuprinsul ei, prezintă caracter contencios, instanța sesizată va declina competenţa în favoarea instanţei competente potrivit procedurii contencioase
B. cererea necontencioasă se judecă în camera de consiliu, cu citarea petentului şi a persoanelor arătate în cerere, dacă legea o impune
C. încheierile pronunţate în această materie au autoritatea lucrului judecat",B
Drept Procesual Civil,"59.  Prin hotărârea judecătorească definitivă nr. x/2018, pronunţată de Tribunalul Z, pârâtul BB a fost obligat să plătească reclamantului AA suma de 250.000 de lei reprezentând împrumut acordat şi nerestituit la scadenţă. Pentru efectuarea executării silite în temeiul hotărârii judecătoreşti definitive nr. x/2018, cererea de încuviinţare a executării silite:","A. este de competenţa Tribunalului Z care a soluţionat cauza în primă instanţa
B. poate fi formulată numai de către executorul judecătoresc
C. se soluţionează în camera de consiliu, cu citarea părților",B
Drept Procesual Civil,"55.  Reclamantul A formulează cerere de lămurire cu privire la aplicarea dispozitivului hotărârii. Pârâtul B solicită respingerea cererii ca neîntemeiată, cu obligarea reclamantului la plata cheltuielilor de judecată. Instanța respinge cererea de lămurire a dispozitivului ca neîntemeiată, iar cu privire la cheltuielile de judecata dispune:","A. obligarea reclamantului la plata cheltuielilor de judecată aferente cererii de lămurire a dispozitivului
B. suportarea de către stat a cheltuielilor de judecată, indiferent de soluția pronunțată în cererea de lămurire a dispozitivului hotărârii
C. respingerea cererii de acordare a cheltuielilor de judecată ca inadmisibilă, întrucât legea nu prevede în acest caz",A
Drept Procesual Civil,57.  ,"A. creditorul poate pretinde daune-interese suplimentare pentru toate cheltuielile făcute pentru recuperarea
B. citaţia, pentru primul termen de judecată, va fi înmânată părţilor cu 3 zile înaintea termenului de judecată
C. întâmpinarea nu este obligatorie",A
Drept Procesual Civil,"58.  În soluţionarea unei cauze civile, citarea părţilor este lăsată la aprecierea instanţei în următoarele cazuri:","A. în cazul soluţionării cererii de strămutare
B. în cazul soluţionării unei cereri de ordonanţă preşedinţială
C. în cazul soluţionării conflictului de competenţă",B
Drept Procesual Civil,51.  Nu poate fi ascultat ca martor:,"A. persoana afectată de o boală psihică, atestată prin act medical, chiar dacă nu este pusă sub intedicție judecătorească
B. sora mamei reclamantului, chiar dacă părțile consimt
C. descendentul, în procesele privitoare la filiaţie",C
Drept Procesual Civil,57.  Ordonanța președințială:,"A. este întotdeauna supusă numai apelului
B. se soluționează de instanța judecătorească competentă să se pronunțe în primă instanță asupra fondului dreptului
C. este inadmisibilă când este în curs judecata asupra fondului",B
Drept Procesual Civil,48.  Este inadmisibilă formularea unei cereri reconvenţionale în următoarele cazuri:,"A. pârâtul-intimat, într-o acţiune în revendicare, formulează cererea reconvenţională direct în apel, având şi acordul expres al reclamantului-apelant
B. pârâtul formulează cererea reconvenţională în cursul rejudecării fondului după casarea cu reţinere
C. pârâtul formulează o cerere reconvenţională în urma admiterii contestaţiei în anulare dacă obiectul căii de atac l-a constituit o hotărâre de primă instanţă, motivul admiterii căii de atac fiind nelegala citare a pârâtului",AB
Drept Procesual Civil,"42.  Prin cererea de chemare în judecată, înregistrată pe rolul Judecătoriei J, reclamantul AA a solicitat rezoluțiunea contractului de vânzare cu clauză de întreținere încheiat cu pârâtul BB. La al doilea termen de judecată, cu procedura de citare legal îndeplinită, la apelul părților răspunde reclamantul AA, pârâtul BB fiind lipsă. La acest termen reclamantul AA depune o cerere de renunțare la judecată. În acest context:","A. instanța va dispune comunicarea cererii de renunțare la judecată pârâtului BB și îi va pune în vedere să își exprime poziția cu privire la cererea de renunțare
B. având în vedere că renunțarea s-a făcut după comunicarea cererii de chemare în judecată, instanța, la
C. hotărârea prin care Judecătoria J. constată renunțarea la judecată nu este supusă niciunei căi de atac",AB
Drept Procesual Civil,"60.  AA, în calitate de creditor, a început executarea silită împotriva debitorului BB, în baza hotărârii judecătoreşti definitive nr. X/2014, prin care debitorul fusese obligat la plata sumei de 3000 de lei. După efectuarea mai multor acte de executare silită prin care fusese recuperată parţial suma de 1500 de lei din cei 3000 de lei, executarea silită a fost desfiinţată ca urmare a introducerii, de către debitorul BB, a unei contestaţii la executare. În cadrul acestei contestaţii la executare, debitorul BB nu a solicitat şi întoarcerea executării silite. În acest context, debitorul BB:","A. nu mai poate solicita, pe cale separată, întoarcerea executării cu privire la suma de 1500 de lei deoarece acest capăt de cerere trebuia introdus obligatoriu odată cu contestaţia la executare
B. va putea solicita, pe cale separată, întoarcerea executării silite cu privire la suma de 1500 de lei, printr-o cerere introdusă la instanţa competentă material potrivit criteriului valoric
C. va putea solicita , pe cale separată, întoarcerea executării silite cu privire la suma de 1500 de lei, printr-o cerere introdusă la instanţa de executare",C
Drept Procesual Civil,"56.  Dacă există hotărâri definitive potrivnice, date de instanţe de acelaşi grad sau de grade diferite, cu încălcarea autorităţii de lucru judecat:","A. se poate cere revizuirea celei de a doua hotărâri, chiar dacă aceasta nu evocă fondul
B. termenul de revizuire este de 30 de zile şi curge de la data rămânerii definitive a ultimei hotărâri
C. cererea de revizuire este de competenţa instanţei mai mare în grad faţă de instanţa care a dat prima hotărâre, cu excepţia situaţiei în care una dintre instanţele de recurs este Înalta Curte de Casaţie şi Justiţie, caz în care cererea de revizuire se va judeca de această instanţă",AC
Drept Procesual Civil,"42.  În cazul în care s-a formulat o cerere de strămutare, se poate suspenda judecarea procesului a cărei strămutare se solicită:","A. la cerere, cu darea unei cauţiuni în cuantum de 1000 de lei, fără citarea părţilor, dacă există motive temeinice, chiar înainte de primul termen de judecată
B. prin încheiere motivată şi care nu este supusă nici unei căi de atac
C. de instanţa competentă să judece cererea de strămutare",AC
Drept Procesual Civil,41.  ,"A. nu poate fi invocată direct în apel
B. dacă este admisă, va avea drept consecință anularea actelor de procedură săvârșite de cel care nu are
C. nu poate fi invocată de instanţă din oficiu",B
Drept Procesual Civil,43.  Hotărârea judecătorească prin care se constată perimarea:,"A. este definitivă când perimarea se constată de o secţie a Înaltei Curţi de Casaţie şi Justiţie
B. nu se poate ataca cu apel, în nici o situaţie
C. este supusă recursului, în termen de 5 zile de la comunicare atunci când perimarea este constatată de",B
Drept Procesual Civil,"57.  În materia termenelor procedurale, este adevărat că:","A. termenele care se socotesc pe ore, încep să curgă de la împlinirea celei de-a doua ore din momentul
B. nerespectarea oricărui termen procedural atrage decăderea din dreptul de a mai efectua acel act de
C. actele de procedură transmise prin fax sau e-mail, în ultima zi a termenului procedural care se socoteşte",C
Drept Procesual Civil,59.  Hotărârea prin care se soluţionează contestaţia la executare:,"A. este supusă aceloraşi căi de atac ca şi hotărârea judecătorească ce se execută, hotărârii prin care s-a soluţionat contestaţia privind înţelesul, întinderea sau aplicarea titlului executoriu
B. este supusă recursului în cazul hotărârii prin care s-a soluţionat contestaţia împotriva executării silite însăşi
C. este supusă numai apelului în cazul hotărârii prin care s-a soluţionat contestaţia privind înţelesul, întinderea sau aplicarea titlului executoriu care nu constituie hotărâre a unui organ de jurisdicţie",AC
Drept Procesual Civil,"44.  Clienta AA se adresează avocatului X,  solicitându-i să formuleze acțiune având ca obiect: ”să se constate că AA este singura moştenitoare a defunctului D, decedat la 10.11.2014, în calitate de nepoată”. Întrebată fiind, de către avocat, cine ar avea calitate de pârât, clienta a arătat că este singura moştenitoare a defunctului şi nu are cu cine să se judece. În aceste condiții:","A. avocatul va formula o cerere în procedură necontencioasă, pentru a i se recunoaşte şi a i se consolida petentei dreptul obţinut prin succesiune
B. avocatul nu va declanșa o acțiune în justiție, explicându-i clientei sale că orice cerere de chemare în judecată trebuie să cuprindă, printre altele, numele şi domiciliul părţilor, sub sancţiunea nulităţii; în speță, nu este determinat pârâtul și, în lipsa acestui element esențial, o astfel de cerere ar fi declarată nulă
C. avocatul va putea formula o cerere în procedură contencioasă, în contradictoriu cu Statul român, pentru a i se recunoaşte şi a i se consolida reclamantei dreptul obţinut prin succesiune",B
Drept Procesual Civil,60.  În lipsa părţii nelegal citate:,"A. neregularitatea privind procedura de citare poate fi invocată şi de celelalte părţi, însă numai la termenul la care s-a produs
B. neregularitatea privind procedura de citare poate fi invocată şi de instanţă din oficiu, în orice stare a pricinii
C. neregularitatea privind procedura de citare nu poate fi invocată de instanţă din oficiu",A
Drept Procesual Civil,42.  În cazul conflictului negativ de competenţă:,"A. acesta se rezolvă în camera de consiliu, fără citarea părţilor, printr-o hotărâre definitivă, care are autoritate de lucru judecat
B. ivit între două secţii ale unei instanţe, declinările de competenţă între acestea s-au făcut prin încheieri care nu sunt supuse niciunei căi de atac
C. ivit între o curte de apel şi ÎCCJ, se rezolvă de către Completul de 5 judecători al instanţei supreme",AB
Drept Procesual Civil,"50.  Dacă pârâtul are, în legătură cu cererea reclamantului, pretenţii derivând din acelaşi raport juridic dedus judecăţii sau strâns legat de acesta:","A. întotdeauna, pentru a-şi valorifica aceste pretenţii, este obligat să formuleze cerere reconvențională
B. poate formula o cerere reconvențională care trebuie depusă odată cu întâmpinarea sau, dacă pârâtul nu este obligat la întâmpinare, cel mai târziu la primul termen de judecată, sub sancţiunea judecării separate a acesteia
C. poate formula o cerere reconvențională care se va comunica reclamantului pentru a formula întâmpinare, nefiind aplicabilă procedura regularizării cererii de chemare în judecată",C
Drept Procesual Civil,49.  Excepţia conexităţii:,"A. poate fi invocată şi din oficiu cel mai târziu, la primul termen de judecată înaintea instanţei ulterior sesizate
B. se soluţionează prin încheiere care poate fi atacată separat
C. în caz de admitere are ca efect trimiterea dosarului în care s-a invocat instanţei mai întâi învestite, în toate",A
Drept Procesual Civil,48.  ,"A. apelul exercitat doar de AA nu poate profita, în nici o situaţie, reclamanţilor BB şi CC;
B. apelul exercitat de AA va profita și reclamanţilor BB şi CC, în cazul în care va fi admis;
C. consecințele respingerii căii de atac cu privire la acordarea cheltuielilor de judecată pentru faza apelului",BC
Drept Procesual Civil,"59.  În cazul în care partea a depus cererea de chemare în judecată prin mandatar şi şi-a ales domiciliul la mandatarul său, arătându-l pe acesta ca persoană însărcinată cu primirea actelor de procedură, iar mandatarul a semnat de primirea citației pentru un termen de judecată:","A. partea nu va mai fi citată în tot cursul judecății la acea instanță, chiar dacă nu se înfățișează la termenul pentru care a fost citată, afară de cazul în care prin lege se prevede altfel
B. partea trebuie să fie citată pentru termenele ulterioare dacă nu se înfățișează la termenul pentru care a fost citată
C. partea care se înfățișează înaintea instanței la termenul pentru care a fost citată nu va mai fi citată în tot cursul procesului, inclusiv în căile de atac",A
Drept Procesual Civil,53.  Interdicția dovedirii cu martori a actului juridic cu valoare mai mare de 250 de lei:,"A. este reglementată de norme de ordine publică, părţile neputând conveni să folosească proba cu martori în
B. vizează nu doar încheierea acelui act, ci și modificarea sa
C. operează, în toate cazurile, inclusiv contra unui profesionist, dacă actul a fost făcut de acesta în exercițiul",B
Drept Procesual Civil,51.  Sancțiunea procedurală a decăderii nu intervine:,"A. în cazurile în care termenul imperativ reglementat de lege este prevăzut pentru un act ce trebuie efectuat de către procuror
B. atunci când legea permite părții care putea invoca decăderea să renunțe la acest drept
C. atunci când aceasta priveşte pe una din părţile legate printr-un raport de solidaritate sau indivizibilitate, iar cel puţin una dintre celelalte părţi a efectuat actul de procedură în termen",AB
Drept Procesual Civil,51.  Conflictul de competență:,"A. se soluţionează în camera de consiliu, cu citarea părților, printr-o hotărâre definitivă
B. ivit între o instanță judecătorească și un alt organ cu activitate jurisdicțională se rezolvă de instanța
C. ivit între două instanţe judecătoreşti se soluţionează, în toate cazurile, de Înalta Curte de Casaţie şi Justiţie care va pronunţa o hotărâre obligatorie pentru instanţa de trimitere",B
Drept Procesual Civil,51.  Referitor la procedura administrării probelor de către avocați:,"A. aceasta poate avea loc în orice litigiu, dacă părțile prezente personal sau reprezentate prin avocat convin acest lucru
B. dacă s-a încuviinţat audierea ca martori a copiilor care nu au împlinit vârsta de 14 ani, aceasta se va face numai de către instanţa judecătorească
C. dacă s-a dispus cercetarea la fața locului, aceasta se va face numai de către instanța judecătorească",BC
Drept Procesual Civil,"50.  În ceea ce priveşte efectele înfiinţării popririi executorii, este adevărat că:","A. atunci când se popresc sume cu scadenţe succesive, indisponibilizarea nu se va extinde asupra sumelor exigibile în viitor
B. indisponibilizarea se extinde şi asupra fructelor civile ale creanţei poprite
C. pot fi opuse creditorului popritor actele de dispoziţie făcute ulterior înfiinţării popririi de debitorul poprit asupra bunurilor poprite",B
Drept Procesual Civil,46.  ,"A. se poate schimba cauza cererii de chemare în judecată;
B. se pot explicita pretenţiile care au fost cuprinse implicit în cererile sau apărările adresate primei instanţe;
C. se pot solicita venituri ajunse la termen după darea hotărârii primei instanţe.",BC
Drept Procesual Civil,"25.  Reclamantul A. introduce o cerere de chemare în judecată în contradictoriu cu pârâtul B.B. prin care solicită ca acesta să plătească suma de 15.000 de lei reprezentând împrumut acordat şi nerestituit la termen. În motivarea cererii, A.A. precizează că există între părţi un contract de împrumut ajuns la scadenţă, că B.B. nu a restituit voluntar acest împrumut nici chiar după ce a fost notificat, anterior introducerii cererii, prin executor judecătoresc, să-şi execute obligaţia asumată. De asemenea, A.A. solicită instanţei de judecată şi obligarea pârâtului la plata sumei de 2000 de lei reprezentând cheltuieli de judecată ocazionate de acest proces. Pârâtul B.B. formulează întâmpinare, solicitând respingerea cererii ca neîntemeiată şi acordarea cheltuielilor de judecată în cuantum de 1000 de lei. În acest context:","A. dacă, după sesizarea instanţei, pârâtul B.B. îşi execută în întregime obligaţia de plată, reclamantul A.A. poate să renunţe la judecată fără a putea fi obligat la plata cheltuielilor de judecată făcute de pârâtul B.B., având în vedere executarea voluntară a acestuia
B. dacă, după sesizarea instanţei, pârâtul B.B. îşi execută în întregime obligaţia de plată, reclamantul A.A. nu trebuie să renunţe la judecată dacă doreşte să obţină cheltuieli de judecată de la pârâtul B.B.
C. reclamantul poate să învedereze instanţei intervenirea cauzei de stingere a obligaţiei, cererea de chemare în judecată urmând a fi respinsă ca rămasă fără obiect, iar pârâtul va putea fi obligat la plata cheltuielilor de judecată",BC
Drept Procesual Civil,"51.  Una dintre părţi a formulat contestaţie în anulare împotriva hotărârii prin care s-a soluţionat cererea de strămutare, pe motiv că nu a fost legal citată şi nici prezentă la termenul când a fost judecată aceasta cerere. În acest context vi se solicită o consultanţă juridică referitoare la admisibilitatea contestaţiei în anulare şi instanţa competentă să o soluţioneze. În acest caz:","A. contestaţia în anulare este inadmisibilă, deoarece hotărârea prin care s-a soluţionat cererea de strămutare nu este supusă niciunei căi de atac
B. contestaţia în anulare este de competenţa aceleiaşi instanţe care a soluţionat cererea de strămutare
C. contestaţia în anulare este admisibilă, deoarece hotărârea prin care s-a soluţionat cererea de strămutare este definitivă",BC
Drept Procesual Civil,"45.  Prin hotărârea pronunțată în cauză, instanța de judecată a admis cererea de chemare în judecată și a dispus anularea contractului de vânzare încheiat între părți. Prin hotărârea pronunţată instanța a omis să se pronunțe cu privire la cererea reclamantului de acordare a cheltuielilor de judecată constând în onorariul avocatului și cu privire la cererea expertului judiciar desemnat în cauză să efectueze expertiza, cu privire la achitarea unui onorariu suplimentar. În acest caz:","A. expertul va putea solicita completarea hotărârii, chiar dacă nu este parte în proces
B. instanţa va putea din oficiu, cu citarea părţilor, să completeze hotărârea pronunţată cu privire la cererile
C. reclamantul este îndrituit să solicite completarea hotărârii în privința cheltuielilor de judecată, neputând",AC
Drept Procesual Civil,"50.  Dacă într-un proces civil, pe rol, se formulează cerere reconvenţională, este adevărat că:","A. pârâtul, pe calea cererii reconvenţionale, poate formula orice pretenţii proprii, în raport cu reclamantul
B. pârâtul îşi poate îndrepta cererea reconvenţională şi împotriva altor persoane decât reclamantul din cererea principală, persoane ce dobândesc calitatea de pârâţi în cererea reconvenţională
C. dacă reclamantul din cererea iniţială devine pârât în cererea reconvenţională, acesta poate formula cerere reconvenţională la cererea reconvenţională a pârâtului iniţial",B
