Drept Procesual Civil,59.  În ceea ce priveşte instanţa de executare:,"A. aceasta este judecătoria în a cărei circumscripţie se află, la data sesizării organului de executare, bunurile ce urmează a fi executate silit, în afara cazurilor în care legea dispune altfel
B. dacă prin lege nu se dispune altfel, aceasta se pronunţă prin încheiere executorie, care poate fi atacată cu recurs, în termen de 10 zile de la comunicare
C. aceasta soluţionează cereri de încuviinţare a executării silite",C
Drept Procesual Civil,"43.  Spre deosebire de excepţia lipsei calităţii de reprezentant, excepţia lipsei calităţii procesuale active a pârâtului:","A. poate fi invocată şi direct în apel
B. se soluționează prin încheiere interlocutorie
C. are efect peremptoriu, dacă este admisă",A
Drept Procesual Civil,"49.  Potrivit legii, se poate ataca cu recurs:","A. încheierea prin care tribunalul a dispus suspendarea judecării procesului ca urmare a sesizării Curții de
B. hotărârea prin care Înalta Curte de Casație și Justiție constată că a intervenit perimarea unui recurs aflat
C. hotărârea prin care a fost admisă excepția necompetenței teritoriale de ordine privată, invocată de pârât prin întâmpinare",AB
Drept Procesual Civil,58.  În procedura de evacuare a imobilelor folosite sau ocupate fără drept:,"A. cererea de evacuare se judecă fără citarea părţilor în cazul în care evacuarea imobilului pentru neplata chiriei se solicită în baza unui contract care constituie, pentru plata acesteia, titlu executoriu, potrivit legii
B. întâmpinarea nu este obligatorie
C. hotărârea de evacuare este executorie şi poate fi atacată numai cu recurs",AB
Drept Procesual Civil,52.  Hotărârea judecătorească:,"A. are autoritate de lucru judecat cu privire la chestiunea tranşată când soluţionează, în tot sau în parte, fondul procesului sau statuează asupra unei excepţii procesuale ori asupra oricărui alt incident
B. are forţa probantă a unui înscris autentic
C. este obligatorie şi produce aceleaşi efecte între părţi, succesorii acestora şi terţi",AB
Drept Procesual Civil,"50.  Cererea de chemare în judecată, formulată de reclamantul AA în contradictoriu cu pârâtul BB, a fost admisă prin sentinţa civilă nr. X/2019 pronunţată în dosarul nr. Y/2019. Cu această ocazie, cererea reclamantului AA de obligare a pârâtului BB la plata cheltuielilor de judecată, constând în onorariu avocațial, a fost respinsă ca neîntemeiată având în vedere că reclamantul nu a depus la dosarul cauzei înscrisuri justificative ale acestor cheltuieli. Reclamantul AA formulează apel împotrivasoluţiei de respingere a cererii de acordare a cheltuielilor de judecată. Apelul se respinge ca nefondat, iar părţile nu formulează recurs. Ulterior, reclamantul AA formulează o nouă cerere de chemare în judecată, constituindu-se dosarul nr. Z/2021 prin care solicită obligarea pârâtului BB la plata cheltuielilor de judecată constând în onorariu de avocat provenite din dosarul nr. Y/2019. În acest context:","A. întrucât a câștigat procesul în dosarul nr. Y/2019, reclamantul AA este îndreptăţit să obțină în dosarul nr. Z/2021 obligarea pârâtului BB la plata cheltuielilor de judecată constând în onorariu avocat aferent dosarului nr. Y/2019
B. pentru apelul promovat de reclamantul AA împotriva sentinţei civile nr. X/2019 dată în dosarul nr. Y/2019 nu trebuie achitată, conform legii, taxă judiciară de timbru
C. dacă reclamantul AA nu ar fi solicitat acordarea cheltuielilor de judecată în primă instanţă în dosarul nr. Y/2019, ar fi fost îndreptăţit să solicite, în cadrul dosarului nr. Z/2021 şi cheltuieli de judecată aferente acestui din urmă dosar, sub rezerva dovedirii acestora, în condiţiile legii",BC
Drept Procesual Civil,28.  În ceea ce priveşte conţinutul unei hotărâri judecătoreşti:,"A. întocmirea dispozitivului prin folosirea unor formulări neclare de natură să creeze confuzii şi să inducă dubii cu privire la soluţia adoptată poate fi complinită prin procedura îndreptării hotărârilor judecătoreşti
B. în cazul în care există contrarietate între dispozitiv şi considerente, dispozitivul conţinând o altă concluzie decât aceea pe care considerentelor o impuneau, hotărârea în cauză este considerată ca fiind nemotivată
C. lipsa dispozitivului unei hotărâri judecătoreşti de primă instanţă, supusă apelului, atrage nulitatea hotărârii, nulitate ce poate fi invocată prin intermediul căii de atac a apelului, deoarece provoacă părţilor o vătămare care nu se poate înlătura decât prin anularea hotărârii",BC
Drept Procesual Civil,"48.  Arătarea titularului dreptului, spre deosebire de cererea de chemare în garanție:","A. nu parcurge etapa admisibilității în principiu
B. nu trebuie făcută în forma unei cereri de chemare în judecată
C. poate fi făcută doar de către pârât",BC
Drept Procesual Civil,"48.  Între AA și BB s-a încheiat, în anul 2020, un contract de închiriere a unui spațiu comercial pentru o perioadă de un an, fără posibilitatea operării tacitei relocațiuni. La începutul anului 2022, după expirarea termenului de închiriere, constatând că locatarul BB refuză să părăsească imobilul, AA formulează o cerere prin care solicită, pe calea procedurii speciale de evacuare din imobilele folosite sau ocupate fără drept, evacuarea lui BB din imobilul ocupat fără drept. În acest caz:","A. instanța competentă va fi judecătoria în circumscripţia căreia se află imobilul închiriat
B. cererea este inadmisibilă, AA putând obține, în această situație, numai evacuarea pe calea unei acţiuni de evacuare de drept comun, procedura specială nefiind aplicabilă evacuării din spaţiile comerciale
C. în cazul admiterii cererii de evacuare formulată de AA, hotărârea de evacuare este executorie din primă instanţă",AC
Drept Procesual Civil,"22.  Reclamantul AA cu domiciliul în Bucureşti, strada X, nr. 1 formulează în contradictoriu cu pârâtul BB, cu domiciliul în Bucureşti, strada X, nr. 2, o cerere de ordonanţa președințială prin care solicită suspendarea lucrărilor de construcție edificate de pârâtul BB pe terenul reclamantului La primul termen de judecată, reclamantul AA fiind lipsă, depune la dosar, prin registratură, un înscris prin care precizează că „își alege domiciliul în vederea citării şi comunicării actelor de procedură în Bucureşti, strada Y, nr. 10”. Prin același înscris, AA solicită şi amânarea judecării cauzei pe motivul că citația privind primul termen de judecată a fost primită cu 3 zile înainte de termen, în conformitate cu cele dispuse de judecătorului cauzei. În acest caz:","A. instanţa va respinge cererea de amânare, reclamantul AA fiind legal citat la domiciliul său din Bucureşti, strada X, nr. 1, adresă indicată în cererea introductivă
B. alegerea de domiciliu făcută de reclamantul AA nu va produce efecte, instanţa urmând a-l cita şi a-i comunica actele de procedură în Bucureşti, strada X, nr. 1
C. instanţa va amâna judecarea cauzei pentru legala citare a reclamantului AA la domiciliul procesual ales, respectiv la Bucureşti, strada Y, nr.10",AB
Drept Procesual Civil,"54.  În cazul prescripţiei dreptului de a obţine executarea silită a unei hotărâri judecătoreşti, este adevărat că:","A. dacă se împlinește termenul de prescripţie, se pierde definitiv, în toate cazurile, dreptul creditorului de a mai
B. termenul de prescripţie curge de la data pronunţării hotărârii judecătoreşti de primă instanță, chiar dacă
C. prescripţia nu se suspendă pe timpul cât executarea silită este suspendată la cererea creditorului urmăritor",C
Drept Procesual Civil,"29.  Cu privire la motivul de recurs prevăzut la art. 488 alin. 1 pct. 5 din Noul Cod de procedură civilă (când, prin hotărârea dată, instanța a încălcat regulile de procedură a căror nerespectare atrage sancțiunea nulității):","A. nulitatea absolută poate fi invocată, în toate cazurile, direct în recurs, ca motiv de casare
B. nulitatea absolută poate fi invocată, după sesizarea instanţei de recurs, pe cale de excepţie absolută, dar numai dacă pentru soluţionarea ei nu este necesară administrarea altor dovezi în afara înscrisurilor noi
C. nulitatea relativă poate fi invocată ca motiv de casare numai de partea ocrotită prin norma încălcată, cu condiţia să nu i se datoreze chiar ei neregularitatea şi numai dacă a fost invocată în termen în faţa instanţei unde s-a produs neregularitatea",BC
Drept Procesual Civil,41.  În ceea ce priveşte contestaţia privind tergiversarea procesului:,"A. se formulează în scris şi se depune la instanţa superioară instanţei învestite cu soluţionarea procesului în legătură cu care se invocă tergiversarea procesului
B. depunerea contestaţiei nu determină suspendarea soluţionării cauzei
C. dacă se apreciază că este întemeiată, instanţa va pronunţa o încheiere care poate fi atacată odată cu fondul şi prin care se iau, de îndată, măsurile necesare înlăturării situaţiei care a provocat tergiversarea judecăţii",B
Drept Procesual Civil,"42.  În privinţa stabilirii competenţei materiale, este adevărat că:","A. în cazul în care s-ar solicita desfiinţarea contractului şi restituirea bunului ce face obiectul contractului,
B. în cazul cererilor având ca obiect renta viageră, pentru stabilirea competenţei instanţei se va ţine seama de
C. în cazul cererilor având ca obiect plata unei părţi dintr-o creanţă, valoarea cererii se stabileşte prin raportare",AB
Drept Procesual Civil,55.  ,"A. hotărârea de declinare a competenţei nu este supusă niciunei căi de atac;
B. hotărârea de declinare a competenţei poate fi atacată de reclamatul AA cu apel;
C. reclamatul AA poate invoca, în condiţiile legii, excepţia de necompetenţă teritorială în faţa Judecătoriei T.",AC
Drept Procesual Civil,"59.  În ceea ce priveşte suspendarea executării silite, în cadrul contestaţiei la executare:","A. de regulă, pentru a se dispune suspendarea executarii silite, cel care o solicită trebuie sa dea în prealabil o cauţiune
B. asupra cererii de suspendare a executării silite, instanţa, în toate cazurile, se va pronunţa prin sentință
C. suspendarea executării silite se soluţionează printr-o încheiere care poate fi atacată numai cu apel în mod separat, în termen de 5 zile de la pronunţare pentru partea prezentă, respectiv de la comunicare pentru cea lipsă",A
Drept Procesual Civil,"42.  Prin cererea de chemare în judecată reclamantul AA a solicitat, în contradictoriu cu pârâtul BB, anularea testamentului prin care defunctul CC, cu ultimul domiciliu în Sibiu, l-a instituit legatar universal pe fratele său BB, dezbaterea succesiunii potrivit dispozițiilor legale și partajarea imobilului situat în Cluj-Napoca, singurul bun aflat în masa succesorală. În acest caz:","A. competența materială pentru soluționarea cauzei va aparține instanței de la locul situării imobilului
B. competența teritorială va aparține instanței de la ultimul domiciliu al defunctului CC
C. competența materială va reveni judecătoriei, indiferent de valoarea imobilului",BC
Drept Procesual Civil,"49.  A şi B au formulat o acţiune în revendicare împotriva lui C, pentru o suprafaţă de teren, situată în comuna Z. Pârâtul deţine terenul în baza unei procuri de administrare dată de proprietarul terenului, persoana D. În aceste condiţii:","A. pârâtul C are posibilitatea să formuleze o cerere a titularului dreptului cu privire la D, iar dacă reclamanţii nu consimt la înlocuirea pârâtului, terţul D va dobândi calitatea de intervenient principal, chiar dacă recunoaşte susţinerile pârâtului
B. pârâtul C are posibilitatea să formuleze o cerere a titularului dreptului, iar dacă terţul D va contesta cele susţinute de pârât, procesul va continua numai între reclamanţii A,B şi pârâtul C
C. pârâtul are posibilitatea să invoce, prin întâmpinare, excepţia lipsei calităţii procesuale pasive în ceea ce îl priveşte",AC
Drept Procesual Civil,59.  În cazul executării hotărârilor judecătoreşti referitoare la minori:,"A. dacă debitorul nu se va conforma somaţiei executorului, acesta, la cererea creditorului, va sesiza instanţa de executare pentru aplicarea de penalităţi pe zi de întârziere, până la executarea obligaţiei prevăzute în titlu executoriu
B. executarea se va efectua, în toate cazurile, în mod obligatoriu, în prezenţa unui reprezentant al direcţiei generale de asistenţă socială şi protecţia copilului şi a unui psiholog desemnat de această direcţie
C. executarea silită poate fi declanşată şi fără somaţie prealabilă din partea executorului judecătoresc",A
Drept Procesual Civil,44.  Excepția litispendenței:,"A. nu poate fi invocată de instanţă din oficiu
B. poate fi invocată în orice stare a procesului în faţa instanţelor de fond
C. se soluționează de către instanța ulterior sesizată, prin încheiere care poate fi atacată separat cu apel",B
Drept Procesual Civil,43.  Instanța învestită cu o cerere de suspendare provizorie a executării silite:,"A. nu este obligată să își verifice competența
B. nu este îndreptățită să pronunțe o soluție de declinare a competenței, chiar dacă nu este competentă să soluționeze cauza pe fond
C. este obligată să își verifice competența potrivit dispozițiilor generale, iar, în cazul în care constată că nu este competentă să soluționeze cauza pe fond, trebuie să pronunțe o soluție de declinare a competenței în",C
Drept Procesual Civil,59.  ,"A. poate fi invocată în orice stare a procesului, chiar înaintea instanţei de recurs;
B. poate fi invocată şi din oficiu de către instanţă;
C. poate fi invocată în apel numai dacă a fost invocată în primă instanţă şi s-a respins.",AB
Drept Procesual Civil,"50.  În ceea ce priveşte participarea terților la procesul civil, este adevărat că:","A. cererea de chemare în judecată a altei persoane se va depune de intervenientul principal cel mai târziu până la terminarea cercetării procesului înaintea primei instanțe
B. cererea de intervenție accesorie poate fi făcută direct în fața instanței de recurs
C. împotriva încheierii prin care a fost respinsă ca inadmisibilă cererea de intervenție voluntară principală se poate formula separat recurs",AB
Drept Procesual Civil,"21.  Reclamantul AA (soţ) formulează o cerere de divorţ, în contradictoriu cu pârâta BB (soţie), solicitând instanţei desfacerea căsătoriei din culpa exclusivă a pârâtei BB. La al treilea termen de judecată, în primă instanţă, pârâta BB formulează o cerere reconvențională în contradictoriu cu reclamantul AA, prin care solicită desfacerea căsătoriei din culpa exclusivă a soțului reclamant AA, având în vedere faptul că după primul termen de judecată cu privire la divorţ, reclamantul AA a devenit violent cu pârâta BB şi i-a interzis, prin blocarea ușii, să mai locuiască în locuința comună, bun propriu al pârâtei BB. În acest caz, țintând cont de faptul că la toate termenele de judecată procedura de citare a fost legal îndeplinită:","A. cererea reconvenţională a pârâtei-reclamante BB urmează a fi respinsă ca tardiv formulată
B. dacă din probele administrate va rezulta atât culpa reclamantului AA, cât şi a pârâtei BB, în destrămarea căsătoriei, instanţa de judecată va pronunţa divorţul din culpa ambilor soţi
C. dacă numai cererea de divorţ introdusă de reclamantul-pârât AA este în stare de a fi judecată, instanţa de judecată poate dispune disjungerea şi judecarea separată a cererii reconvenționale formulate de pârâta-reclamantă BB",B
Drept Procesual Civil,"57.  Reclamanta AA cheamă în judecată pe pârâtul BB solicitând instanței de judecată să dispună desfacerea căsătoriei dintre cei doi soți pe motive medicale, respectiv că reclamanta suferă de o boală ce face imposibilă continuarea căsătoriei, sarcinile căsătoriei nemaiputând fi îndeplinite. Din probatoriul administrat în cauză, a reieșit într-adevăr că reclamanta suferă de o boală ce face imposibilă continuarea căsătoriei, dar și că boala a contactat-o în timpul căsătoriei, pârâtul neglijând-o, neaducându-i soției reclamante suport moral sau material. În acest caz, instanța de judecată:","A. va desface căsătoria din culpa ambilor soți, întrucât și pârâtul este vinovat de destrămarea căsătoriei
B. va desface căsătoria dintre soți
C. hotărârea judecătorească pronunțată nu va face mențiune despre culpa pentru desfacerea căsătoriei",BC
Drept Procesual Civil,"52.  Nu există autoritate de lucru judecat al primei hotărâri judecătoreşti, faţă de al doilea proces, în următoarele situaţii:","A. în primul proces reclamantul AA, în contradictoriu cu pârâtul BB, a invocat drept cauză a dreptului său de proprietate, cu privire la imobilul X, uzucapiunea, cererea fiind respinsă definitiv pe fond; în al doilea proces reclamantul AA, în contradictoriu cu pârâtul BB, a promovat o acţiune în legătură cu acelaşi imobil X, pretinzând că a dobândit dreptul de proprietate pe calea moştenirii
B. în primul proces reclamantul AA, în contradictoriu cu pârâtul BB, a solicitat restituirea bunului Y, întemeindu-şi pretenţia pe un contract de comodat, cererea fiind respinsă definitiv pe fond; în al doilea proces reclamantul AA, în contradictoriu cu pârâtul BB, a solicitat restituirea bunului Y, întemeindu-şi pretenţia pe un contract de depozit
C. în primul proces reclamantul AA, în contradictoriu cu pârâtul BB, formulează o acţiune în revendicare cu privire la imobilul Z, susţinând ca temei al dreptului său, un contract de vânzare-cumpărare, cererea fiind respinsă definitiv pe fond deoarece nu s-a făcut dovada acestui contract; în al doilea proces, reclamantul AA, în contradictoriu cu pârâtul BB, formulează din o acţiune în revendicare cu privire la imobilul Z motivată de faptul că s-a procurat înscrisul constatator al vânzării-cumpărării",AB
Drept Procesual Civil,"47.  În ceea ce priveşte încheierea cu privire la admisibilitatea în principiu, în cazul intervenţiei voluntare principale:","A. aceasta se atacă numai o dată cu fondul, indiferent de soluţia pronunţată
B. dacă s-a respins cererea de intervenţie ca inadmisibilă, aceasta poate fi atacată în termen de 5 zile de la comunicare
C. aceasta se atacă, dacă s-a respins cererea de intervenţie că inadmisibilă, numai cu apel dacă încheierea a fost dată în primă instanţă, respectiv numai cu recurs la instanţa ierarhic superioară, în ipoteza în care încheierea a fost pronunţată în apel",C
Drept Procesual Civil,46.  Invocarea neregularităților privind procedura de citare trebuie să respecte următoarele condiționalități legale:,"A. invocarea neregularităților se poate face, după caz, de partea interesată și de instanță din oficiu, nefiind posibilă invocarea de către partea adversă
B. când partea se prezintă în instanță prin mandatar avocat, deși nu a primit citația în termenul stabilit de lege, neregularitatea se acoperă, partea nelegal citată neavând dreptul să solicite acordarea unui nou termen de judecată în vederea pregătirii apărării
C. în lipsa părții nelegal citate, neregularitatea privind procedura de citare a acesteia poate fi invocată de instanță din oficiu, însă numai la termenul la care ea s-a produs",C
Drept Procesual Civil,"54.  Judecătoria X respinge ca neîntemeiată cererea de chemare în judecată formulată de reclamantul AA, în contradictoriu cu pârâtul BB, prin care solicita plata unei sumei de 3000 de lei reprezentând împrumut acordat şi nerestituit în termen. În urma comunicării hotărârii judecătoreşti pronunţate, reclamantul AA sesizează că există neconcordanţe între considerente şi dispozitiv şi că hotărârea cuprinde şi considerente contradictorii. În acest caz:","A. reclamantul AA este în drept să formuleze o cerere de lămurire a hotărârii în vederea înlăturării neconcordanţei între considerente şi dispozitiv
B. reclamantul AA este în drept să formuleze o cerere de lămurire a hotărârii în vederea înlăturării considerentelor contradictorii
C. viciile hotărârii sesizate de către reclamantul AA pot fi înlăturate doar prin intermediul căilor de atac de reformare",C
Drept Procesual Civil,58.  În cadrul contestaţiei la executare:,"A. la cererea părţilor, instanța este obligată să solicite relații și explicații scrise de la executorul judecătoresc
B. este aplicabilă procedura de verificare şi regularizare a cererii prevăzută de art. 200 NCPC
C. instanța va pune în vedere părții interesate să achite cheltuielile ocazionate de efectuarea copiilor certificate de pe actele de executare contestate",C
Drept Procesual Civil,56.  Nu se poate admite o contestație în anulare:,"A. în cazul în care dezlegarea dată apelului sau, după caz, recursului este rezultatul unei vădite greșeli de judecată
B. în cazul în care, anterior introducerii acesteia, o altă parte a formulat o contestație în anulare împotriva aceleiași hotărâri
C. în cazul în care partea invocă faptul că instanța nu s-a pronunțat asupra unui capăt de cerere cu care a fost învestită",AC
Drept Procesual Civil,"45.  Prin sentința civilă nr. X/2023 instanța a respins ca neîntemeiată cererea de chemare în judecată formulată de AA în contradictoriu cu BB privind obligarea acestuia la predarea tablourilor ce fac obiectul contractului de vânzare nr. Z/2020. Împotriva sentinței civile nr. X/2023, AA formulează apel prin care solicită, în principal, anularea sentinței nr. X/2023 și trimiterea cauzei spre rejudecare întrucât nu a fost legal citat în procedura desfășurată în fața primei instanțe. În subsidiar, AA a solicitat schimbarea în tot a sentinței apelate, în sensul admiterii cererii de chemare în judecată. În acest context:","A. dacă se va constata că reclamantul-apelant nu a fost legal citat în fața primei instanțe, instanța de apel nu va putea dispune și trimiterea cauzei spre rejudecare, chiar dacă apelantul a solicitat-o în mod expres, având în vedere caracterul devolutiv al apelului
B. dacă se va constata că reclamantul-apelant nu a fost legal citat în fața primei instanțe, instanța de apel va
C. în situația în care instanța admite apelul, anulează hotărârea atacată și trimite cauza spre rejudecare,",BC
Drept Procesual Civil,"56.  AA a formulat o cerere de chemare în judecată prin care a solicitat obligarea lui BB la plata unei sume de bani, reprezentând contravaloarea chiriei datorată pentru o perioadă de trei luni, conform contractului încheiat între părți. Cererea este introdusă la Judecătoria X. Ulterior introducerii cererii de chemare în judecată și verificării competenței de către instanța sesizată, BB devine judecător la Judecătoria X, motiv pentru care AA formulează o cerere de strămutare, pe motiv de bănuială legitimă prin raportare la calitatea de judecător al lui BB. În acest context:","A. cererea de strămutare este de competența Înaltei Curți de Casație și Justiție
B. formularea cererii de strămutare nu suspendă de drept judecarea cauzei
C. cererea de strămutare se va soluționa în camera de consiliu, fără citarea părților",AB
Drept Procesual Civil,51.  ,"A. se constată, în toate cazurile, prin hotărâre definitivă
B. nu va produce efecte, niciodată, fără acordul expres al pârâtului
C. dacă se face în apel sau în căile extraordinare de atac, instanţa va lua act de renunţare şi va dispune şi",C
Drept Procesual Civil,52.  Nerespectarea dispozițiilor legale referitoare la competența materială a instanței judecătorești determină:,"A. reținerea unei nulități necondiționate de existența unei vătămări
B. existența unei necompetențe de ordine privată
C. întotdeauna, desființarea tuturor actelor de procedură îndeplinite și a probelor administrate la acea instanță",A
Drept Procesual Civil,47.  Sunt admisibile următoarele acţiuni în constatare:,"A. unul dintre moştenitori solicită instanţei să constate calitatea lui de moştenitor şi compunerea masei succesorale, dacă între moştenitori există neînţelegeri cu privire la aceste aspecte
B. reclamantul solicită instanţei să constate că nu are nici o datorie faţă de pârâţi
C. debitorul solicită instanţei să constate că a intervenit prescripţia dreptului de a cere executarea silită, dacă executarea a fost declanşată",A
Drept Procesual Civil,54.  Suspendarea de drept a judecării cauzei nu intervine în cazul:,"A. conflictului negativ de competenţă
B. formulării unei cereri de strămutare
C. când dezlegarea cauzei depinde, în tot sau în parte, de existenţa ori inexistența unui drept care face obiectul unei alte judecăţi",BC
