Drept Procesual Civil,"54.  Cu privire la efectul suspensiv al termenului de apel, este adevărat că:","A. termenul de apel suspendă, în toate cazurile, executarea hotărârii de primă instanţă
B. termenul de apel nu are efect suspensiv dacă hotărârea de primă instanţă a fost dată cu executare provizorie de drept
C. termenul de apel are efect suspensiv dacă hotărârea de primă instanţă a fost dată cu executare provizorie judecătorească",B
Drept Procesual Civil,41.  În cazul unei cereri de chemare în judecată îndreptate împotriva unei persoane juridice de drept privat care are un dezmembrământ fără personalitate juridică:,"A. competenţa teritorială, în toate cazurile, aparţine alternativ instanţei de la sediul principal al persoanei juridice sau instanţei locului unde ea are dezmembrământul fără personalitate juridică
B. competenţa teritorială este alternativă în cazul în care cererea de chemare în judecată are ca obiect obligaţii care izvorăsc din acte încheiate prin reprezentantul dezmembământului ori din fapte săvârşite de acesta
C. competenţa teritorială aparţine, în toate cazurile, exclusiv instanţei de la de la sediul principal al persoanei juridice",B
Drept Procesual Civil,"51.  Reclamantul AA formulează o cerere de chemare în judecată în contradictoriu cu pârâtul BB, cerere de competenţa Judecătoriei X. La primul termen de judecată, în faţa Judecătoriei X, pârâtul BB achiesează parţial la pretenţiile reclamantului AA. În acest caz:","A. instanţa, din oficiu, va da o hotărâre parţială, în măsura recunoaşterii şi va continua judecata cu privire la pretenţiile rămase nerecunoscute
B. în lipsa unei cereri a reclamantului AA de pronunţare a unei hotărâri parţiale, instanţa va respinge în parte, în măsura recunoaşterii, cererea de chemare în judecată ca rămasă fără obiect
C. dacă instanţa va pronunţa, potrivit legii, o hotărâre parţială conform achiesării pârâtului BB, aceasta va putea fi atacată numai cu recurs, la instanţa ierarhic superioară",C
Drept Procesual Civil,58.  În procedura necontencioasă:,"A. încheierile pronunţate nu au autoritate de lucru judecat
B. soluţionarea cererii se face întotdeauna cu citarea părţii
C. instanţa se pronunţă în raport cu toate împrejurările de fapt şi de drept ale cauzei, dacă nu au fost invocate în cerere sau pe parcursul procedurii",AC
Drept Procesual Civil,"47.  Revizuirea în temeiul 509 alin. 1 pct. 1 din Codul de procedură civilă, respectiv când instanţa s-a pronunţat asupra unui lucru care nu s-a cerut (extra petita), este admisibilă:","A. când reclamantul revendică un imobil, iar instanţa respingându-i cererea în revendicare, stabileşte şi faptul că el nu are dreptul al fructele culese în calitate de posesor
B. când reclamantul şi-a modificat cererea de chemare în judecată după primul termen la care a fost legal citat şi, deşi pârâtul nu şi-a exprimat în mod expres acordul cu privire la această modificare, instanţa s-a pronunţat şi cu privire la capătul de cerere formulat peste termen
C. instanţa de apel a primit şi a soluţionat o cerere nouă, inadmisibilă în apel",A
Drept Procesual Civil,"44.  AB a depus la instanţă o cerere de chemare în judecată prin care a solicitat evacuarea lui CD din imobilul proprietatea sa, pentru că acesta a provocat stricăciuni locuinţei. Cererea de chemare în judecată a fost semnată în numele lui AB de numitul EF care a precizat, în scris, pe cerere, imediat sub semnătura sa, faptul că este mandatarul lui AB. Primind cererea, judecătorul a constatat că aceasta are lipsuri în legătură cu reprezentarea lui AB, sens în care va putea solicita, în procedura regularizării, ca aceasta să fie completată cu următoarele, în raport cu calitatea lui EF:","A. în cazul mandatarului neavocat, să se depună procura autentică a acestuia în original sau în copie legalizată
B. în cazul mandatarului avocat, să se depună împuternicirea avocaţială, conform legii sale, certificată ""pentru conformitate cu originalul""
C. în cazul reprezentantului legal să se depună o copie de pe înscrisul doveditor al calităţii",AB
Drept Procesual Civil,43.  Instanţa este învestită cu o cerere de predare a unui imobil ca urmare a expirării termenului de locaţiune. În acest caz:,"A. competenţa teritorială aparţine numai instanţei în circumscripţia căreia se află situat imobilul
B. dacă pârâtul este un judecător care îşi desfăşoară activitatea la instanţa competentă să judece cauza, reclamantul poate alege o altă instanţă de acelaşi grad aflată în circumscripţia oricărei curţi de apel învecinate curţii de apel în circumscripţia căreia se află instanţa care ar fi fost competentă
C. reclamantul poate alege între instanţa de la domiciliul pârâtului şi cea de la locul situării bunului",BC
Drept Procesual Civil,"59.  Potrivit legii, poate formula apel:","A. executorul judecătoresc, împotriva încheierii prin care a fost respinsă cererea de încuviințare a executării
B. debitorul, împotriva încheierii prin care a fost admisă cererea de sechestru asigurător, în termen de 5 zile
C. debitorul, împotriva încheierii prin care a fost admisă cererea creditorului de repunere în termenul de",C
Drept Procesual Civil,"42.  Prin cererea de chemare în judecată promovată împotriva pârâtului BB, reclamantul AA solicită anularea contractului de vânzare cu clauză de întreţinere, întrucât consimţământul acestuia a fost viciat prin dol. În dovedirea pretenţiilor sale, reclamantul AA solicită administrarea probei cu înscrisuri, interogatoriul pârâtului BB şi proba cu martori, însă nu indică în cererea de chemare în judecată, numele şi adresele acestora. La termenul la care se pune în discuţie cererea de probatorii, reclamantul AA se prezintă, însoțit de doi martori care îi sunt rude de gradul III. În acest caz:","A. în ceea ce priveşte condiţiile de admisibilitate a probei cu cei doi martori, aceasta este inadmisibilă deoarece nu este permisă, în nici un caz, împotriva sau peste ceea ce cuprinde un înscris
B. dovezile care nu au fost propuse prin cererea de chemare în judecată sau care au fost propuse, dar cu nerespectarea regulilor formale referitoare la cuprinsul cererii de chemare în judecată, vor putea fi cerute şi încuviințate dacă administrarea acestora nu duce la amânarea judecăţii
C. reclamantul AA şi pârâtul BB pot conveni expres sau tacit ca persoanele care nu pot fi martori, datorită gradului de rudenie, să fie ascultate ca martori",BC
Drept Procesual Civil,"26.  Reclamantul A a introdus o acţiune în revendicare în contradictoriu cu pârâtul B, având ca obiect terenul în suprafaţă de 000 mp situat la adresa X. În urma soluţionării cauzei, instanţa de judecată a admis în parte acţiunea în revendicare, obligându-l pe pârâtul B să lase în deplină proprietate şi paşnică folosinţă o suprafaţă de 2.000 mp din cei 5.000 mp revendicaţi. În termen legal, reclamantul A formulează apel motivând faptul că în mod greşit instanţa de fond a apreciat că a făcut dovada numai pentru suprafaţa de 2.000 mp deoarece din înscrisurile administrate rezultă că acesta şi-a dovedit dreptul de proprietate pentru întreaga suprafaţă. În instanţa de apel, a fost invocată din oficiu, fiind pusa în discuţia părţilor, excepţia autorităţii de lucru judecat, motivat de faptul că în urmă cu 2 ani a existat o acţiune în revendicare între autorul D al apelantului reclamant A (A este unicul fiu al defunctului D) şi pârâtul B cu privire la acelaşi teren situat la adresa X, întemeiată pe acelaşi titlu, acţiune care s-a finalizat prin pronunţarea unei hotărâri definitive de respingere a cererii de revendicare. În acest context:","A. trebuie admisă excepţia autorităţii de lucru judecat, respins apelul reclamantului A, anulată în tot hotărârea primei instanţe şi respinsă cererea de chemare în judecată formulată de A pe temeiul autorităţii de lucru judecat
B. instanţa de apel nu va admite excepţia autorităţii de lucru judecat deoarece nu i se poate crea apelantului, în propria cale de atac, o situaţie mai rea decât cea din hotărârea atacată
C. se va respinge excepţia autorităţii de lucru judecat deoarece nu există identitate de părţi",A
Drept Procesual Civil,"41.  În cazul în care înființarea popririi asiguratorii este cerută de un creditor AA care nu are titlu executoriu şi a cărui creanță faţă de debitorul BB nu este constatată în scris, dar este exigibilă:","A. instanța poate admite cererea, dacă se depune o cauțiune de jumătate din valoarea reclamată şi dacă
B. instanța poate admite cererea, dacă se depune o cauțiune de jumătate din valoarea reclamată, chiar dacă creditorul nu a intentat cerere de chemare în judecată cu privire la fondul pretenţiei
C. competența de soluționare a cererii aparține instanței competente să judece procesul în primă instanță",AC
Drept Procesual Civil,43.  ,"A. nu împiedică faptul că actul de procedură să producă alte efecte juridice decât cele care decurg din natura
B. trebuie să fie invocată, pentru neregularităţile săvârşite în cursul judecăţii, la termenul la care s-a săvârşit
C. are drept efect desființarea actului de procedură de la data constatării nulității de către instanța de",B
Drept Procesual Civil,"52.  În ceea ce priveşte prescripţia dreptului de a obţine executarea silită, este adevărat că:","A. instanţa de executare nu poate invoca, din oficiu, prescripţia dreptului de a obţine executarea silită, în cursul derulării acesteia
B. aceasta se întrerupe dacă executarea silită s-a perimat
C. instanţa de executare competentă va respinge cererea de încuviinţare a executării silite după împlinirea termenului de prescripţie",A
Drept Procesual Civil,56.  Cererea în anulare împotriva ordonanţei de plată:,"A. nu se poate formula, fiind inadmisibilă, în cazul în care instanţa de judecată a respins cererea de ordonanţă de plată
B. trebuie formulată de către debitor în termen de 10 zile de la data înmânării sau comunicării ordonanţei de plată
C. nu suspendă executarea, suspendarea putând fi încuviinţată la cererea debitorului, fără dare de cauţiune",B
Drept Procesual Civil,"44.  În calitate de avocat, vi se solicită o consultanţă juridică în legătură cu următoarea situaţie: pârâtul nu a fost legal citat şi nici prezent la primul termen de judecată. Instanţa nu a sesizat această neregularitate şi a încuviinţat probele solicitate de reclamant, acordând un nou termen în vederea administrării acestora. În acest caz:","A. instanţa a procedat corect, deoarece neregularitatea citării nu ar putea fi invocată decât de către cel vătămat, în speţă pârâtul
B. neregularitatea citării putea fi invocată de instanţă din oficiu şi de către reclamant, însă doar la termenul la care s-a produs
C. pârâtul va putea invoca la termenul următor la care este legal citat sau prezent neregularitatea citării sale la termenul anterior",BC
Drept Procesual Civil,51.  Hotărârea judecătorească:,"A. este obligatorie şi produce efecte față de orice terță persoană
B. atacată cu contestaţie în anulare sau revizuire, nu îşi păstrează autoritatea de lucru judecat pe parcursul
C. are putere executorie, în condiţiile prevăzute de lege",C
Drept Procesual Civil,54.  Nu reprezintă încălcări ale regulii potrivit căreia nu pot fi formulate pretenţii noi în apel următoarele:,"A. în apel pot fi cerute dobânzi ivite după depunerea cererii de chemare în judecată şi până la închiderea dezbaterilor la instanţa de fond
B. în apel poate fi invocată direct compensaţia legală
C. în apel poate fi formulată direct o cerere de chemare în garanţie, cu acordul părţii adverse",B
Drept Procesual Civil,53.  ,"A. hotărârea de evacuare este executorie și poate fi atacată cu recurs, în termenul de 30 de zile;
B. pârâtul nu poate invoca lipsa titlului reclamantului;
C. întâmpinarea nu este obligatorie, iar formularea unei cereri reconvenționale este inadmisibilă.",C
Drept Procesual Civil,52.  ,"A. poate fi atacată numai cu apel, la instanța ierarhic superioară, în termen de 30 de zile de la comunicare;
B. este definitivă și executorie, în cazul în care este rezultatul înțelegerii la care ajung creditorul și debitorul în procedura ordonanței de plată;
C. este definitivă, în toate cazurile.",B
Drept Procesual Civil,"58.  Reclamantul AA (soţ) introduce o cerere de divorţ în contradictoriu cu pârâta BB (soţie) prin care a solicită desfacerea căsătoriei din culpa exclusivă a pârâtei BB. Pârâta BB formulează, în termen legal, întâmpinare susţinând că nu există o culpă exclusivă a acesteia. De asemenea, tot prin întâmpinare pârâta BB învederează că părțile sunt despărțite în fapt de 1 an. În acest caz:","A. instanţa poate pronunţa divorţul din culpa ambilor soţi, dacă din probele administrate va reieşi că amândoi sunt vinovaţi de destrămarea căsătoriei
B. dacă din dovezile administrate va rezulta că numai reclamantul AA este culpabil în destrămarea căsătoriei, cererea de divorţ va fi respinsă ca neîntemeiată
C. dacă din probele administrate rezultă că există o culpă exclusivă a reclamantului AA în destrămarea căsătoriei, instanţa va pronunţa divorţul din culpa exclusivă a lui AA",AB
Drept Procesual Civil,45.  Excepţiile procesuale:,"A. pot fi invocate, întotdeauna, de părţi, procuror sau instanţă, din oficiu
B. constituie apărări de fond
C. tind la amânarea sau împiedicarea judecăţii",C
Drept Procesual Civil,"55.  În cazul căii de atac a recursului, spre deosebire de calea de atac a apelului:","A. în toate cazurile, recursul suspendă de drept executarea hotararii atacate
B. recursul poate fi exercitat numai pentru motive de nelegalitate
C. în instanţa de recurs nu se pot produce noi probe, cu excepţia înscrisurilor noi",BC
Drept Procesual Civil,"42.  Prin cererea de chemare în judecată, reclamantul a solicitat obligarea pârâtului la plata sumei de 247.000 lei, reprezentând: debit principal (150.000 lei), penalităţi contractuale (90.000 lei), cheltuieli de judecată (7000 lei). Cererea a fost introdusă la judecătoria locului prevăzut în contract pentru executarea obligaţiei de plată (altul decât domiciliul pârâtului). În acest context vi se solicită o consultanţă juridică, de către pârât, în vedere invocării prin întâmpinare a unei excepţii de necompetenţă materială şi teritorială în sensul că cererea de chemare în judecată trebuia introdusă la tribunalul de la domiciliul pârâtului. În acest caz:","A. sunt incidente regulile de competență teritorială alternativă și nu se justifică invocarea excepției necompetenței teritoriale deoarece reclamantul are alegerea între mai multe instanțe deopotrivă competente
B. competenţa materială revine judecătoriei, prin urmare nu se justifică invocarea excepţiei necompetenţei
C. competenţa materială revine tribunalului, prin urmare se impune invocarea excepţiei necompetenţei materiale, cel târziu la primul termen la care părţile sunt legal citate în faţa primei instanțe",AB
Drept Procesual Civil,52.  Înscrisul autentic este :,"A. doar înscrisul întocmit de către notarul public
B. înscrisul sub semnătură privată care a fost prezentat notarului public spre a primi dată certă
C. orice înscris emis de către autoritatea publică şi căruia legea îi conferă acest caracter",C
Drept Procesual Civil,48.  ,"A. hotărârea primei instanțe, date în baza recunoașterii pârâtului, este executorie de drept de la data
B. hotărârea primei instanțe, date la solicitarea reclamantului, în baza recunoașterii pârâtului, poate fi
C. când recunoașterea pretențiilor s-a făcut în fața instanței de apel, hotărârea primei instanțe va fi anulată",AC
Drept Procesual Civil,"29.  Prin cererea de chemare în judecată introdusă la data de 25.10.2017, reclamanta G.M. a chemat în judecată pârâtul G.I., solicitând desfacerea căsătoriei din culpa acestuia și revenirea la numele purtat înainte de căsătorie. Prin cererea de chemare în judecată a fost solicitată administrarea probei cu martori, fiind propuși ca martori A.E., mama reclamantei, și G.N., fiul major al soților. Pârâtul nu a formulat întâmpinare. La primul termen de judecată, fiind prezente toate părțile și martorii, instanța a procedat la audierea acestora, pârâtul precizând oral în fața instanței că nu este de acord cu audierea martorii propuși de reclamantă. La același termen, instanța a rămas în pronunțare. În acest context:","A. instanța a procedat greșit, deoarece martorii propuși de reclamantă, fiind rude de gradul I cu aceasta, nu puteau fi audiați decât cu acordul expres sau tacit al pârâtului
B. instanța a procedat corect, deoarece în procesele de divorț pot fi audiați ca martori și rudele și afinii până la gradul III inclusiv
C. instanța a procedat corect în ceea ce privește martorul A.E., însă a procedat greșit în ceea ce privește martorul G.N.",C
Drept Procesual Civil,"24.  Reclamantul AA l-a chemat în judecată pe pârâtul BB, solicitând sistarea stării de indiviziune asupra unui imobil. La primul termen de judecată la care părţile au fost legal citate, BB a învederat instanţei că, după formularea cererii de chemare în judecată, a înstrăinat cota-parte ce- i revenea din dreptul de proprietate asupra imobilului lui CC şi a formulat o cerere de arătare a titularului dreptului în persoana lui CC, solicitând scoaterea sa din proces. În acest context, instanţa:","A. va admite în principiu cererea de arătare a titularului dreptului
B. va dispune introducerea în cauză din oficiu a lui CC, chiar dacă părţile se împotrivesc
C. va respinge ca tardivă cererea de arătare a titularului dreptului, chiar dacă părţile solicită ca aceasta să fie judecată împreună cu cererea principală",B
Drept Procesual Civil,"45.  Reclamantul AA formulează o cerere de chemare în judecată în contradictoriu cu pârâtul BB. În termen legal, pârâtul BB formulează o cerere de chemare în judecată a altei persoane, respectiv a teţului CC care ar putea pretinde același drept ca şi reclamantul AA. După încuviinţarea în principiu a cererii de chemare în judecată a altei persoane, terţul CC:","A. va prelua procedura în starea în care aceasta se află în momentul încuviinţării în principiu a intervenţiei, actele de procedură îndeplinite anterior fiindu-i opozabile
B. va putea să renunţe la judecarea cererii de intervenţie
C. va putea fi scos din proces, dacă obiectul cererii de chemare în judecată constă într-o datorie bănească, iar terţul CC recunoaşte datoria şi vrea să o execute faţă de cel căruia îi va fi stabilit dreptul pe cale judecătorească, dacă a consemnat la dispoziţia instanţei suma datorată",A
Drept Procesual Civil,58.  Instanţa se pronunţă asupra cererii de restituire a cauţiunii:,"A. cu citarea părţilor
B. printr-o încheiere supusă numai recursului dacă cererea este de competenţa tribunalului
C. printr-o încheiere supusă recursului ce urmează a fi soluţionat de completul de 5 judecători de la Î.C.C.J., dacă cu privire la cererea de restituire a cauţiunii se pronunţă una dintre secţiile Î.C.C.J",AB
Drept Procesual Civil,"29.  BB (bancă), în calitate de creditor, solicită executorului judecătoresc declanşarea executării silite împotriva debitorului persoană fizică CC pentru recuperarea sumei de 100.000 de lei reprezentând credit acordat şi nerestituit la scadenţă şi a sumei de 50.000 de lei reprezentând dobânzi şi penalităţi de întârziere aferente creditului restant. După încuviinţarea executării silite, executorul judecătoresc îl somează pe debitor, în data de luni, 28 noiembrie 2016, să achite suma de 100.000 de lei reprezentând credit acordat şi nerestituit la scadenţă şi a sumei de 50.000 de lei reprezentând dobânzi şi penalităţi de întârziere, în termen de 3 zile de primirea somaţiei. În data de marţi, 29 septembrie 2016, debitorul CC se prezintă la dumneavoastră, în calitate de avocat, şi vă solicită să-l reprezentaţi în această procedură execuţională. Analizând titlul executoriu (contractul de credit) sesizaţi că ar fi incidentă o cauză de nulitate absolută în ceea ce priveşte clauza referitoare la formula de calcul a dobânzii. În acest context:","A. debitorul CC va putea să formuleze o contestaţie cu privire la întinderea titlului executoriu, în termenul de prescripţie a dreptului de a obţine executarea silită, clauza referitoare la formula de calcul a dobânzii, afectată de nulitate absolută, fiind relevantă numai sub aspectul stabilirii cuantumului referitor la obligaţia de plată a dobânzii
B. debitorul CC va putea să invoce nulitatea clauzei referitoare la formula de calcul a dobânzii, pe toată perioada executării silite, în acest caz nulitatea absolută fiind imprescriptibilă
C. debitorul CC trebuie să formuleze contestaţie la executare în termen de 15 zile de la primirea somaţiei, contestaţie în cadrul căreia poate să invoce cauza de nulitate absolută a clauzei referitoare la formula de calcul a dobânzii",C
Drept Procesual Civil,"43.  AA, în calitate de reclamant, formulează o cerere de chemare în judecată, în contradictoriu cu pârâtul BB. La primul termen de judecată se prezintă reclamantul AA şi lipseşte pârâtul BB. Din înscrisurile aflate la dosarul cauzei rezultă că pârâtul BB nu fusese legal citat. În acest caz, în lipsa pârâtului BB:","A. neregularitatea privind procedura de citare a pârâtului BB poate fi invocată şi de reclamantul AA, precum şi de instanţă din oficiu
B. neregularitatea privind procedura de citare a pârâtului BB poate fi invocată de instanţă din oficiu, în orice stare a pricinii
C. neregularitatea privind procedura de citare a pârâtului BB poate fi invocată de reclamantul AA până cel mai târziu la termenul imediat următor primului termen de judecată",A
Drept Procesual Civil,"55.  Hotărârea judecătorească pronunţată, în primă instanţă, în procedura ordonanţei președințiale:","A. este supusă, în toate cazurile, numai apelului în termen de 5 zile de la pronunţare, dacă s-a dat cu citarea părţilor şi de la comunicare, dacă s-a dat fără citarea lor
B. este executorie
C. nu va putea fi dată atunci când este în curs judecată asupra fondului",B
Drept Procesual Civil,"55.  Când pârâtul a recunoscut pretenţiile reclamantului, judecătoria ca instanţă de fond:","A. va da, din oficiu, o hotărâre în măsura recunoaşterii
B. va continua judecata, dacă recunoașterea este parţială, cu privire la pretenţiile rămase nerecunoscute
C. va pronunţa o hotărâre, la cererea reclamantului, care poate fi atacată cu apel la instanţa ierarhic superioară",B
Drept Procesual Civil,"44.  Reclamantul A introduce o cerere de chemare în judecată în contradictoriu cu pârâtul B având ca obiect revendicarea unui bun imobil aflat la adresa X. După cel de-al treilea termen de judecată cu procedură completă, în faţa primei instanţe, A vinde dreptul litigios privitor la acest proces lui C. În acest caz:","A. succesorul cu titlu particular C este obligat să intervină în cauză, dacă are cunoştinţă despre existenţa procesului, sau poate să fie introdus în cauză, la cerere sau din oficiu
B. pentru a interveni în proces, succesorul cu titlu particular C trebuie să formuleze o cerere de intervenţie voluntară principală
C. succesorul cu titlu particular C nu va putea invoca excepţia necompetenţei materiale a instanţei",AC
Drept Procesual Civil,"53.  În ceea ce priveşte procedura ordonanţei preşedinţiale, potrivit Codului de procedură civilă:","A. ca regulă, părţile vor fi citate conform normelor privind citarea în procesele urgente, întâmpinarea fiind obligatorie
B. în cazul în care competenţa de primă instanţă aparţine curţii de apel, ordonanţa este supusă recursului în termen de 5 zile de la pronunţare, dacă s-a dat cu citarea părţilor
C. ordonanţa preşedinţială va putea fi dată numai atunci când este în curs judecata asupra fondului",B
Drept Procesual Civil,44.  Nu este o cerere incidentală:,"A. cererea reconvențională
B. cererea de intervenție în interes propriu
C. cererea reclamantei prin care solicită, în cadrul unui proces de stabilire a paternității, și stabilirea contribuţiei la cheltuielile de creştere şi educare a minorului în sarcina pârâtului",C
Drept Procesual Civil,"57.  În conformitate cu dispoziţiile legale în materie, poate fi atacată cu contestaţie în anulare:","A. hotărârea dată în recurs, dacă aceasta a fost pronunţată cu încălcarea normelor referitoare la alcătuirea instanţei şi, deşi se invocase excepţia corespunzătoare, instanţa de recurs a respins-o
B. hotărârea definitivă dată de prima instanţă dacă aceasta a fost pronunţată de o instanţa necompetentă absolut şi, deşi se invocase excepţia corespunzătoare, prima instanţa a omis să se pronunţe asupra acesteia
C. hotărârea dată în recurs, dacă instanţa de recurs nu s-a pronunţat asupra unuia dintre recursurile declarate în cauză",C
