Drept Procesual Penal,"90.  În cazul în care denunţul formulat de o persoană juridică, societate cu răspundere limitată, nu cuprinde codul unic de înregistrare fiscală şi numărul de înmatriculare în registrul comerţului şi, totodată, a fost depus la un parchet necompetent după calitatea persoanei, acesta va dispune:","A. restituirea denunţului pe cale administrativă, cu indicarea elementelor care lipsesc
B. declinarea competenţei în favoarea parchetului competent
C. trimiterea pe cale administrativă a denunţului la parchetul competent",C
Drept Procesual Penal,80.  În procesul penal:,"A. instanţa nu poate în nici un caz audia ca martor pe fostul soţ al inculpatului
B. judecătorul de drepturi şi libertăţi nu poate audia partea civilă potrivit procedurii audierii anticipate
C. organul de cercetare penală nu poate proceda în niciun caz la audierea ca martor a unei persoane care se află într-o situaţie care îi pune la îndoială, în mod rezonabil, capacitatea de a fi martor.",B
Drept Procesual Penal,82.  Atrage nulitatea absolută încălcarea dispoziţiilor legale privitoare la:,"A. autorizarea percheziţiei domiciliare de către judecătorul de drepturi şi libertăţi care activează la o instanţă superioară celei legal competente să judece cauza în primă instanţă
B. efectuarea percheziției la adresa unde locuieşte inculpatul arestat preventiv în altă cauză, în timp ce acesta asista la percheziția efectuată la biroul său
C. asigurarea asistenţei juridice din oficiu a părții civile minore",C
Drept Procesual Penal,80.  Instanţa de judecată poate dispune în cursul cercetării judecătoreşti efectuarea:,"A. unei expertize criminalistice balistice într-o cauză având ca obiect o infracţiune de omor
B. procedeului probatoriu al constatării, când există pericolul de dispariţie a unor mijloace de probă
C. unui supliment de expertiză, atunci când concluziile raportului de expertiză întocmit în cauză necesită anumite lămuriri.",A
Drept Procesual Penal,"86.  Atât măsura preventivă a controlului judiciar, cât și măsura sechestrului asigurător:","A. pot fi luate de către procuror în cursul urmăririi penale
B. în faza de cameră preliminară, trebuie verificate periodic de către judecătorul de cameră preliminară
C. pot fi dispuse numai cu privire la inculpat, respectiv la bunurile acestuia",A
Drept Procesual Penal,78.  În cazul revizuirii:,"A. dacă instanţa respinge cererea de suspendare a executării hotărârii, încheierea poate fi contestată în termen de 48 de ore de la pronunţare pentru cei prezenţi şi de la comunicare pentru cei lipsă
B. instanţa poate dispune luarea măsurii arestării preventive când, după ce a suspendat executarea hotărârii supuse revizuirii, nu sunt respectate, cu rea credinţă, obligaţiile impuse
C. în rejudecarea cauzei, dacă s-a dispus anularea hotărârii, operează efectul extensiv",C
Drept Procesual Penal,98.  Hotărârea prin care instanţa soluţionează acţiunea penală:,"A. nu poate să privească şi acţiunea civilă exercitată în cauză, dacă soluţia pronunţată este de încetare a procesului penal ca urmare a intervenirii prescripţiei răspunderii penale
B. nu poate fi atacată cu apel de soţia inculpatului, dacă acesta a avut apărător ales
C. poate fi atacată cu apel de martorul audiat în cauză, în ceea ce priveşte amenda judiciară care i-a fost aplicată prin sentinţă",C
Drept Procesual Penal,"83.  Este întotdeauna incompatibil să soluţioneze contestaţia împotriva încheierii prin care instanţa a dispus menţinerea controlului judiciar, judecătorul care în aceeaşi cauză:","A. a admis contestaţia procurorului şi a înlăturat dispoziţia de excludere a raportului de expertiză
B. a procedat la audierea anticipată a unui martor
C. a respins anterior contestaţia formulată de un coinculpat împotriva aceleiaşi încheieri de şedinţă",B
Drept Procesual Penal,76.  Asistenţa juridică a inculpatului major este obligatorie în cursul procedurii de cameră preliminară atunci când:,"A. este trimis în judecată, pentru săvârşirea unei infracţiuni sancţionate de lege cu închisoarea de la unu la 5 ani, aflându-se sub control judiciar
B. se analizează necesitatea dispunerii arestului la domiciliu faţă de acesta
C. se pune în discuţie constatarea încetării de drept a măsurii arestării preventive.",BC
Drept Procesual Penal,91.  Atunci când se dispune încetarea procesului penal ca urmare a:,"A. intervenirii amnistiei, instanța nu poate dispune confiscarea cauțiunii
B. împăcării, instanța lasă nesoluționată acțiunea civilă
C. decesului inculpatului, se mențin măsurile asigurătorii luate asupra bunurilor acestuia în vederea reparării pagubei produse prin infracțiunea pentru care a fost trimis în judecată",C
Drept Procesual Penal,82.  Asistența juridică este obligatorie:,"A. în cursul judecății, din momentul dispunerii schimbării încadrării juridice, dacă instanța consideră, în temeiul art.386 Cod procedură penală, că încadrarea juridică dată faptei prin actul de sesizare trebuie schimbată într-o infracțiune pentru care legea prevede pedeapsa închisorii până la 5 ani;
B. în cazul în care inculpatul – aflat în penitenciar în executarea unei pedepse - trimis în judecată pentru comiterea infracțiunii de înșelăciune, prevăzută de art. 244 alin. 1 Cod penal și pedepsită cu închisoarea de la 6 luni la 3 ani, se împacă cu persoana vătămată;
C. la încheierea acordului de recunoaștere a vinovăției pentru infracțiunea de furt simplu.",BC
Drept Procesual Penal,86.  Este considerată ca fiind în termenul legal contestaţia formulată:,"A. de procuror împotriva încheierii judecătorului de drepturi şi libertăţi prin care se respinge propunerea de arestare preventivă, înregistrată în registrul de ieşire al parchetului, la 36 de ore de ia pronunţare şi care se înregistrează la judecătorul de drepturi şi libertăţi care a pronunţat încheierea la 3 zile de la pronunţare, pentru situaţia în care termenul curge de la pronunţare
B. împotriva hotărârii prin care s-a respins cererea de reabilitare, depusă de condamnat în termen de 10 zile de la comunicare, la instanţa ierarhic superioară
C. de inculpatul faţă de care s-a luat măsura arestării preventive, depusă la administraţia locului de deţinere la 24 ore de la comunicare şi care se înregistrează la judecătorul de drepturi şi libertăţi care a pronunţat încheierea, la 4 zile de la comunicare, pentru situaţia în care termenul curge de la comunicare.",BC
Drept Procesual Penal,"82.  În cursul urmăririi penale, percheziţia informatică poate fi dispusă:","A. indiferent de natura infracţiunii care face obiectul cercetării, în măsura în care este utilă cauzei
B. de procurorul care efectuează sau supraveghează urmărirea penală, în caz de pericol de disparţie a datelor informatice, cu obligaţia acestuia de a sesiza în termen de 48 de ore judecătorul de drepturi şi libertăţi de la instanţa căreia i-ar reveni competenţa să judece cauza în primă instanţă în vederea confirmării măsurii
C. numai în prezenta inculpatului arestat preventiv, asistat de un apărător desemnat din oficiu",A
Drept Procesual Penal,84.  Măsura preventivă a arestului la domiciliu:,"A. poate dura mai mult de 5 ani în cursul judecăţii
B. poate fi prelungită de judecătorul de cameră preliminară, numai la cererea procurorului, dacă pedeapsa prevăzută de lege pentru infracţiune este mai mare de 4 ani
C. poate fi luată de instanţa de judecată, din oficiu, prin sentinţa penală de condamnare a inculpatului.",A
Drept Procesual Penal,99.  Termenul de 5 zile în care procurorul trebuie să depună propunerea de prelungire a arestării preventive împreună cu dosarul cauzei la judecătorul de drepturi și libertăți:,"A. este un termen regresiv şi peremptoriu
B. este un termen procedural și dilatoriu
C. expiră la sfârșitul primei zile lucrătoare care urmează, dacă ultima zi a termenului cade într-o zi nelucrătoare",A
Drept Procesual Penal,87.  Măsura preventivă a controlului judiciar încetează de drept atunci când prima instanță:,"A. a dispus condamnarea cu suspendarea executării pedepsei sub supraveghere
B. a dispus condamnarea inculpatului la pedeapsa amenzii penale
C. a luat față de inculpatul minor o măsură educativă neprivativă de libertate",B
Drept Procesual Penal,93.  Este incompatibil:,"A. judecătorul de cameră preliminară, învestit să soluţioneze contestaţia împotriva luării măsurii sechestrului asigurator, atunci când în cursul urmăririi penale a soluționat plângerea prin care inculpatul a solicitat modificarea unei obligații din conținutul controlului judiciar dispus de procuror;
B. judecătorul învestit cu o cerere de redeschidere a procesului penal, care anterior a admis plângerea împotriva soluției de clasare a procurorului și a trimis cauza la procuror pentru completarea urmăririi penale;
C. judecătorul care a soluţionat contestaţia împotriva încheierii de menţinere a arestului la domiciliu în procedura de cameră preliminară şi care este învestit ulterior şi cu contestaţia împotriva încheierii de menţinere a acestei măsuri în cursul judecăţii.",AB
Drept Procesual Penal,85.  Obiectele ridicate la percheziţie care constituie mijloace de probă în condițiile art.162 Cod procedură penală:,"A. sunt atașate la dosar sau păstrate în alt mod;
B. sunt păstrate numai la organul de urmărire penală până la soluționarea definitivă a cauzei;
C. se restituie în toate cazurile persoanei căreia îi aparţin, dacă nu au legătură cu cauza.",A
Drept Procesual Penal,99.  În cauzele cu infractori minori:,"A. nu este obligatorie citarea de către organele de urmărire penală a părinţilor sau, după caz, a altui reprezentant legal, la orice ascultare a minorului în calitate de suspect sau inculpat
B. admiterea cererii de judecare a cauzei în procedura recunoaşterii învinuirii poate avea loc dacă este încuviinţată de reprezentantul său legal, iar probele sunt suficiente pentru aflarea adevărului şi justa soluţionare a cauzei
C. la încheierea unui acord de recunoaştere a vinovăţiei limitele perioadei pe care se dispune măsura educativă privativă de libertate se reduc cu o treime, iar cele prin care se dispune o măsură educativă neprivativă de libertate se reduc cu o pătrime",B
Drept Procesual Penal,"79.  Dispoziţiile din materia apelului privind repunerea în termen sunt aplicabile, în mod corespunzător:","A. în cazul contestaţiei împotriva încheierii prin care judecătorul de drepturi şi libertăţi a dispus luarea măsurii controlului judiciar
B. în cazul contestaţiei în anulare
C. în cazul plângerii împotriva soluţiei de clasare dispusă de procuror",A
Drept Procesual Penal,91.  Percheziţia:,"A. domiciliară nu se poate dispune în locuinţa unei persoane, dacă urmărirea penală a fost începută numai cu privire la faptă (in rem);
B. corporală se efectuează exclusiv de organele judiciare;
C. se poate efectua în şifonierul cu haine al soţiei suspectului, chiar dacă aceasta nu se află în domiciliu în momentul efectuării percheziţiei, dar este prezent soţul său.",C
Drept Procesual Penal,85.  Asistenţa juridică este obligatorie:,"A. în cursul urmăririi penale, pentru inculpatul major, aflat în stare de libertate, care a comis infracţiunea de care este acuzat în timp ce era minor
B. dacă inculpatul se află în executarea măsurii internării într-un centru educativ, aplicată într-o altă cauză
C. la examinarea admisibilităţii în principiu a cererii de revizuire formulate de condamnatul privat de libertate.",B
Drept Procesual Penal,90.  Judecata poate avea loc potrivit procedurii abreviate a recunoaşterii învinuirii:,"A. numai dacă instanţa a fost sesizată prin rechizitoriu
B. chiar dacă inculpatul solicită schimbarea încadrării juridice a faptelor descrise în rechizitoriu şi recunoscute de el
C. în cazul în care inculpatul, absent de la proces, recunoaşte comiterea faptelor de care este acuzat, prin intermediul avocatului său ales.",B
Drept Procesual Penal,86.  Necompetenţa materială a judecătoriei poate fi invocată:,"A. doar până la începerea cercetării judecătoreşti
B. în tot cursul judecăţii, până la pronunţarea hotărârii definitive
C. ca motiv de contestaţie în anulare.",B
Drept Procesual Penal,91.  Calitatea unei persoane de inculpat într-o cauză penală:,"A. poate coexista cu cea de suspect, cercetat pentru o altă infracţiune, în aceeaşi cauză
B. nu poate fi dobândită în situaţia în care suspectul se sustrage de la urmărirea penală
C. este obligatorie pentru a putea dispune măsura reţinerii",A
Drept Procesual Penal,"84.  Data de 17.09.2021 (vineri) reprezintă ultima zi de formulare a apelului pentru inculpat. În această zi, la ora 16:45, inculpatul trimite pe adresa e-mail a instanței o cerere de apel, mesajul electronic fiind primit în aceeași zi. La data de 20.09.2021 (luni), la începerea programului de lucru, cererea de apel astfel primită este înregistrată la registratura instanței. Apelul este:","A. formulat în termen
B. formulat în termen doar dacă cererea a fost primită la instanţă înainte de încheierea programului de lucru din ziua de 17.09.2021
C. tardiv formulat",A
Drept Procesual Penal,94.  Partea responsabilă civilmente poate fi introdusă în procesul penal până la începerea cercetării judecătoreşti:,"A. de către instanţa de judecată, din oficiu
B. la cererea procurorului, atunci când exercită acţiunea civilă
C. la cererea inculpatului.",B
Drept Procesual Penal,"94.  Declarația de martor dată de o persoană care, în aceeași cauză, anterior declarației, a avut calitatea de inculpat:","A. poate fi folosită împotriva sa în altă cauză penală
B. nu poate fi luată în considerare pentru pronunțarea unei soluții de condamnare în cazul celorlalți inculpați
C. poate fi folosită în favoarea sa, în cazul în care redobândește calitatea de inculpat",C
Drept Procesual Penal,99.  Poate asista la şedinţa de judecată:,"A. persoană înarmată care doreşte să prezinte instanţei arma cu care inculpatul a comis asupra ei tentativa de omor
B. persoana fără discernământ
C. minorul sub 14 ani care are calitatea de parte civilă în cauză.",BC
Drept Procesual Penal,96.  Şedinţa de judecată este întotdeauna nepublică:,"A. atunci când se soluţionează plângerea împotriva măsurii controlului judiciar dispuse de procuror
B. atunci când la şedinţă asistă şi minori
C. atunci când se pune în discuţie o cerere de schimbare de încadrare juridică din infracţiunea de act sexual cu un minor în infracţiunea de viol",A
Drept Procesual Penal,87.  Punerea în mișcare a acțiunii penale poate fi dispusă de către:,"A. organul de cercetare penală
B. procuror
C. judecătorul de cameră preliminară, atunci când admite plângerea împotriva soluției de clasare",B
Drept Procesual Penal,87.  Sancţiunea nulităţii absolute intervine atunci când:,"A. judecătorul de drepturi şi libertăţi soluţionează propunerea de arestare preventivă în şedinţă publică
B. inculpatul nu a fost citat la efectuarea percheziţiei informatice şi aceasta s-a desfăşurat în lipsa lui
C. apelul inculpatului, care a dobândit calitatea de europarlamentar după pronunţarea hotărârii de condamnare de către judecătorie, a fost soluţionat de curtea de apel şi nu de Înalta Curte de Casaţie şi Justiţie",B
Drept Procesual Penal,81.  Acțiunea civilă în procesul penal:,"A. poate avea ca obiect repararea prejudiciului material prin restituirea lucrului
B. nu poate fi exercitată de persoana căreia persoana vătămată i-a transmis, pe cale convențională, mai înainte de constituirea de parte civilă, dreptul la repararea prejudiciului
C. este admisibilă dacă partea civilă a revenit asupra renunţării la pretenţiile civile până la începerea cercetării judecătoreşti",A
Drept Procesual Penal,"90.  În cazul în care inculpatul major solicită ca judecata să aibă loc potrivit procedurii recunoaşterii învinuirii, beneficiază de reducerea cu o treime a limitelor pedepsei închisorii:","A. dacă instanţa respinge solicitarea acestuia dar, cu ocazia deliberării, reţine aceeaşi situaţie de fapt ca cea recunoscută de către inculpat, schimbând însă încadrarea juridică a faptei
B. numai dacă instanţa, respingând solicitarea acestuia, reţine, cu ocazia deliberării, aceeaşi situaţie de fapt ca cea recunoscută de către inculpat şi aceeaşi încadrare juridică a faptei ca cea stabilită prin rechizitoriu
C. dacă instanţa admite solicitarea acestuia dar, cu ocazia deliberării, schimbă încadrarea juridică a faptei.",AC
Drept Procesual Penal,81.  Măsură arestării preventive a inculpatului dispusă în cauză încetează de drept:,"A. la dată rămânerii definitive a hotărârii de condamnare la pedeapsa închisorii cu executare în regim de detenţie
B. la pronunţarea în primă instanţă a hotărârii prin care s-a aplicat inculpatului măsura educativă a internării într-un centru educativ
C. în cazul în care instanţa verifică dacă subzistă temeiurile care au determinat menţinerea măsurii preventive la mai mult de 60 de zile de la ultima menţinere a acestei măsuri.",AC
Drept Procesual Penal,"84.  La data de 10.04.2018 (într-o zi de marţi) a fost comunicată inculpatului încheierea judecătoriei prin care s-a dispus începerea judecății, constatându-se, totodată, că nu au fost formulate cereri sau excepții. Contestația formulată de acesta la data de 16.04.2018 este:","A. în termen
B. tardivă
C. inadmisibilă",A
Drept Procesual Penal,"77.  Inculpatul nu se mai citează pentru termenele ulterioare, având termenul în cunoştinţă, în cazul în care:","A. citaţia a fost primită de soţia inculpatului, iar la termenul de judecată stabilit se prezintă doar apărătorul desemnat din oficiu, care declara că a luat legătură cu inculpatul
B. citaţia pentru acel termen a fost înmânată funcţionarului însărcinat cu primirea corespondenţei din cadrul instituţiei publice, aceasta fiind inculpată în cauză
C. la termenul stabilit, acesta se prezintă personal, în stare de arest preventiv, fiind asistat de apărătorul ales.",B
Drept Procesual Penal,"83.  Atunci când într-o cauză penală se dispune efectuarea unei expertize, expertul:","A. nu poate să aibă, concomitent, atât calitatea de expert desemnat de organul judiciar, cât şi pe aceea de expert recomandat de persoana vătămată să asiste la efectuarea expertizei
B. nu mai poate fi audiat de către instanţă după depunerea raportului de expertiză
C. după desemnarea sa de către instanţă, nu poate solicita lămuriri părţilor",A
Drept Procesual Penal,77.  Măsurile asigurătorii în vederea reparării pagubei produse prin infracțiune:,"A. pot fi luate la cererea părții civile, doar dacă aceasta indică bunurile inculpatului asupra cărora solicită înființarea măsurii
B. nu pot fi extinse de prima instanță asupra bunurilor părții responsabile civilmente, dacă partea civilă își mărește întinderea pretențiilor după începerea cercetării judecătorești, dar înainte de terminarea acesteia
C. încetează de drept, dacă persoana vătămată nu introduce acțiune în fața instanței civile în termen de 30 de zile de la rămânerea definitivă a hotărârii de achitare a inculpatului pe motiv că fapta nu e prevăzută de legea penală, hotărâre prin care acțiunea civilă a fost lăsată nesoluționată",C
Drept Procesual Penal,84.  Reconstituirea:,"A. se efectuează în prezenţa obligatorie a avocatului unui inculpat judecat pentru tentativă la infracţiunea de omor
B. exclude prezenţa altor persoane în afara celei suspectate că ar fi comis fapta cercetată
C. nu poate fi dispusă în cursul urmăririi penale",A
Drept Procesual Penal,"92.  În ceea ce privește judecata, este corectă afirmația potrivit căreia:","A. nu poate fi desfășurată în procedura simplificată a recunoașterii învinuirii într-o cauză având ca obiect o infracțiune contra patrimoniului care a produs consecințe deosebit de grave
B. omisiunea acordării ultimului cuvânt al inculpatului atrage sancțiunea nulității absolute
C. participarea procurorului este obligatorie, sub sancțiunea nulității absolute, și la judecarea acțiunii civile disjunse",C
Drept Procesual Penal,97.  Amenda judiciară:,"A. nu poate fi aplicată de un organ de cercetare penală
B. aplicată de procuror poate fi redusă de judecătorul de cameră preliminară
C. poate fi aplicată şi expertului a cărui cerere de înlocuire a fost încuviinţată",C
Drept Procesual Penal,85.  Perioada în care suspectul sau inculpatul a fost internat într-o instituţie de specialitate în vederea efectuării unei expertize psihiatrice se deduce din durata pedepsei pronunţate:,"A. numai dacă internarea a fost nevoluntară
B. numai dacă internarea a fost voluntară
C. indiferent dacă internarea a avut caracter voluntar sau nevoluntar",C
Drept Procesual Penal,97.  Citirea actului de sesizare:,"A. nu se mai dispune de preşedintele completului de judecată, dacă inculpatul solicită judecarea în procedura recunoaşterii învinuirii
B. vizează fie rechizitoriul, fie acordul de recunoaştere a vinovăţiei cu care instanţa a fost sesizată
C. este prealabilă efectuării cercetării judecătoreşti",C
Drept Procesual Penal,97.  Instanța de judecată:,"A. poate schimba prin sentință încadrarea juridică dată faptei prin actul de sesizare, inclusiv în situația în care inculpatul este judecat în procedura recunoașterii învinuirii;
B. poate dispune reunirea cauzelor în cazul în care constată că pe rolul altei instanțe se află o cauză având ca obiect o infracțiune săvârşită de notarul public X, în calitate de instigator la infracțiunea de uz de fals comisă de Y, minor în vârstă de 17 ani, ce face obiectul cauzei aflate pe rolul său, ambele cauze aflându-se în faza apelului
C. constată încetată de drept măsura arestului la domiciliu în cursul judecăţii în primă instanţă, dacă durata totală a acesteia (4 ani) a depășit jumătatea maximului special prevăzut de lege pentru infracțiunea care face obiectul sesizării prin acordul de recunoaștere a vinovăției, chiar dacă inculpatul este minor",C
Drept Procesual Penal,85.  În cursul cercetării judecătoreşti pot fi administrate:,"A. şi probele necontestate de părţi sau persoana vătămată
B. şi probe ce au fost excluse în procedura soluţionării plângerii împotriva ordonanţei de clasare, în cazul în care s-a admis plângerea şi s-a dispus începerea judecăţii
C. probe noi prin care să se dovedească aspecte ce au făcut obiectul unor mijloace de probă excluse în procedura de cameră preliminară.",AC
Drept Procesual Penal,"100.  Inculpatul X a fost condamnat la pedeapsa de 1 an închisoare de Judecătoria Arad, sentinţa rămânând definitivă prin neapelare. În acest caz:","A. inculpatul poate face oricând contestaţie în anulare, dacă judecata a avut loc fără participarea procurorului, care era obligatorie potrivit legii
B. persoana vătămată poate formula cerere de revizuire la instanţa civilă asupra laturii civile, în cazul în care nu a fost legal citată
C. dacă este admisă cererea inculpatului X de redeschidere a procesului penal, instanţa se va pronunţa prin încheiere ce poate fi atacată doar o dată cu fondul.",C
Drept Procesual Penal,"90.  Instanţa sesizată cu un acord de recunoaştere a vinovăţiei, în condiţiile art. 480 şi următoarele Cod procedură penală:","A. va schimba încadrarea juridică a faptei reţinute în acord, atunci când constată că această încadrare este una greşită;
B. va respinge acordul de recunoaştere a vinovăţiei atunci când inculpatul, în faţa instanţei de judecată, retrage consimţământul valabil exprimat în cursul urmăririi penale;
C. va dispune punerea de îndată în libertate a inculpatului arestat preventiv în cauză, atunci când admite acordul de recunoaştere a vinovăţiei care prevede pedeapsa închisorii cu suspendarea sub supraveghere a executării acesteia.",C
Drept Procesual Penal,98.  Are competenţă de a soluţiona o cerere de anulare a reabilitării judecătoreşti:,"A. Tribunalul Bucureşti, atunci când hotărârea de condamnare a fost pronunţată în primă instanţă de Înalta Curte de Casaţie şi Justiţie
B. instanţa în a cărei circumscripţie domiciliază condamnatul, corespunzătoare în grad celei care a judecat în primă instanţă cauza în care s-a pronunţat condamnarea
C. Judecătoria Sectorului 2 Bucureşti, ori de câte ori infracţiunea care a atras condamnarea a fost săvârşită în străinătate.",B
Drept Procesual Penal,84.  Prezenţa inculpatului în faţa judecătorului de drepturi şi libertăţi nu este obligatorie atunci când se soluţionează:,"A. propunerea de prelungire a măsurii arestului la domiciliu
B. propunerea de prelungire a măsurii arestării preventive, ori de câte ori inculpatul este bolnav
C. contestaţia împotriva măsurii asigurătorii dispuse de procuror.",AC
Drept Procesual Penal,81.  Un minor în vârstă de 10 ani:,"A. poate fi audiat ca martor, însă nu depune jurământ
B. nu poate fi audiat ca martor, existând prezumţia legală absolută a lipsei de discernământ
C. poate fi audiat ca martor, însă este obligatoriu ca la audiere să asiste un psiholog",A
